{
  "docs": [
    {
    "message_type": "wanted",
    "timestamp": "2010-03-05T22:47:45",
    "tags": [
      {
        "tag": "wanted",
        "type": "msg_type"
      },
      {
        "tag": "eggs",
        "type": "tag"
      },
      {
        "tag": "chickens",
        "type": "tag"
      },
      {
        "tag": "barter",
        "type": "currency"
      },
      {
        "tag": "ooooby",
        "type": "group"
      },
      {
        "tag": "new_zealand",
        "type": "loc"
      },
      {
        "tag": "waikato",
        "type": "loc"
      },
      {
        "tag": "nawton",
        "type": "loc"
      }
    ],
    "raw_text": "@ooooby wanted:  fertile eggs #eggs #chickens in l:Nawton, Hamilton: for  #barter until 31/03/2010",
    "message_pointer": {
      "provider_name_space": "ooooby",
      "message_id": "0211da9c-d344-4f5c-8876-08dbff2267e9"
    },
    "created_by": {
      "type": "OpenSocialUserPointer",
      "provider_user_name": "Sarah Walsh",
      "provide_name_space": "ooooby",
      "profile_pic_url": "http://api.ning.com/files/lBZpf7Wkv7q88YC4XvXZ75bgWqmy6cDdktjpLRoCGi3*W9VPsj7r4lI21QnEMIoB31jOHwe5RgpTC1oA1Lj*oAWWwIGEcG9P/SDC10135.JPG?crop=1%3A1",
      "profile_url": "http://ooooby.ning.com/profile/SarahWalsh"
    },
    "offer_text": " wanted:  fertile eggs #eggs #chickens in l:Nawton, Hamilton: for  #barter until 31/03/2010",
    "more_info_url": null,
    "thumbnail": null,
    "end_by": "2010-03-31T00:00:00",
    "end_by_text": "31/03/2010",
    "location": {
      "geo_lat": -37.779811,
      "geo_long": 175.237982,
      "address": "Nawton, Hamilton",
      "tags": [
        {
          "tag": "new_zealand",
          "type": "loc"
        },
        {
          "tag": "waikato",
          "type": "loc"
        },
        {
          "tag": "nawton",
          "type": "loc"
        }
      ]
    }
  },
  {
    "message_type": "offer",
    "timestamp": "2010-03-04T02:06:14",
    "tags": [
      {
        "tag": "offer",
        "type": "msg_type"
      },
      {
        "tag": "veges",
        "type": "tag"
      },
      {
        "tag": "barter",
        "type": "currency"
      },
      {
        "tag": "ooooby",
        "type": "group"
      },
      {
        "tag": "new_zealand",
        "type": "loc"
      },
      {
        "tag": "taranaki",
        "type": "loc"
      },
      {
        "tag": "new_plymouth",
        "type": "loc"
      }
    ],
    "raw_text": "@ooooby offer:  Big fat kamokamo squash - exchange for fruit or veg. #veges in l:New Plymouth (central): for  #barter until 18/03/2010",
    "message_pointer": {
      "provider_name_space": "ooooby",
      "message_id": "0404bdab-f7ed-4885-a765-e0c695ddc178"
    },
    "created_by": {
      "type": "OpenSocialUserPointer",
      "provider_user_name": "Richard Grevers",
      "provide_name_space": "ooooby",
      "profile_pic_url": "http://api.ning.com/files/RgukZpJPOMsSXoN-ueWuqUhNYQ0lrLa52IgVyXhQ5c4BO47AhK4DItNpfMfUXJUov8nks0lSGuMVQ12gSgPumA*S9KvHxmPM/rg_pastel_square.jpg?crop=1%3A1",
      "profile_url": "http://ooooby.ning.com/profile/RichardGrevers"
    },
    "offer_text": " offer:  Big fat kamokamo squash - exchange for fruit or veg. #veges in l:New Plymouth (central): for  #barter until 18/03/2010",
    "more_info_url": null,
    "thumbnail": null,
    "end_by": "2010-03-18T00:00:00",
    "end_by_text": "18/03/2010",
    "location": {
      "geo_lat": -39.058054,
      "geo_long": 174.076433,
      "address": "New Plymouth (central)",
      "tags": [
        {
          "tag": "new_zealand",
          "type": "loc"
        },
        {
          "tag": "taranaki",
          "type": "loc"
        },
        {
          "tag": "new_plymouth",
          "type": "loc"
        }
      ]
    }
  },
  {
    "message_type": "offer",
    "timestamp": "2010-03-03T07:58:38",
    "tags": [
      {
        "tag": "offer",
        "type": "msg_type"
      },
      {
        "tag": "fruit",
        "type": "tag"
      },
      {
        "tag": "trees",
        "type": "tag"
      },
      {
        "tag": "barter",
        "type": "currency"
      },
      {
        "tag": "cash",
        "type": "currency"
      },
      {
        "tag": "ooooby",
        "type": "group"
      },
      {
        "tag": "new_zealand",
        "type": "loc"
      }
    ],
    "raw_text": "@ooooby offer:  Young Fig Trees in PB6.5 pots. Healthy and strong, from tree that produces delicious fruit! #fruit #trees in l:Tawa St, Waiheke: for  #barter #cash until 31/03/2010",
    "message_pointer": {
      "provider_name_space": "ooooby",
      "message_id": "0736d71c-4d27-44b6-aaf4-fb4a3ab76082"
    },
    "created_by": {
      "type": "OpenSocialUserPointer",
      "provider_user_name": "James Samuel",
      "provide_name_space": "ooooby",
      "profile_pic_url": "http://api.ning.com/files/v3Rd0puud3Er-vcIf0dKfxL8GWZa-iuL*6WCNg2C4cNS-*HuUvJNXwmUXCfDrSlqFsXuiK5-x35vHu5Xf5Y6Bg02deXtmjKZ/759825080.jpeg?crop=1%3A1",
      "profile_url": "http://ooooby.ning.com/profile/JamesSamuel"
    },
    "offer_text": " offer:  Young Fig Trees in PB6.5 pots. Healthy and strong, from tree that produces delicious fruit! #fruit #trees in l:Tawa St, Waiheke: for  #barter #cash until 31/03/2010",
    "more_info_url": null,
    "thumbnail": null,
    "end_by": "2010-03-31T00:00:00",
    "end_by_text": "31/03/2010",
    "location": {
      "geo_lat": -36.786622,
      "geo_long": 175.019286,
      "address": "Tawa St, Waiheke",
      "tags": [
        {
          "tag": "new_zealand",
          "type": "loc"
        }
      ]
    }
  },
  {
    "message_type": "offer",
    "timestamp": "2010-03-04T02:24:43",
    "tags": [
      {
        "tag": "offer",
        "type": "msg_type"
      },
      {
        "tag": "seeds",
        "type": "tag"
      },
      {
        "tag": "barter",
        "type": "currency"
      },
      {
        "tag": "cash",
        "type": "currency"
      },
      {
        "tag": "ooooby",
        "type": "group"
      },
      {
        "tag": "new_zealand",
        "type": "loc"
      },
      {
        "tag": "hawkes_bay",
        "type": "loc"
      },
      {
        "tag": "bay_view",
        "type": "loc"
      }
    ],
    "raw_text": "@ooooby offer:  Seeds -huge variety-Flowers, Veges, Herbs-list availiable on request #seeds in l:Bay View: for  #barter #cash",
    "message_pointer": {
      "provider_name_space": "ooooby",
      "message_id": "0dcd9b39-b17a-413d-973c-f52ec2836271"
    },
    "created_by": {
      "type": "OpenSocialUserPointer",
      "provider_user_name": "Hester Robson",
      "provide_name_space": "ooooby",
      "profile_pic_url": "http://api.ning.com/files/LiiijI5B2KqLmbx6YV8E64cSlUvelp6Tp3L4R4besCGebyXLjrm*hBYuUc44ivTCa-c4Is5TPE513BAI6ci8NCjafZPjpQML/OscarMesmall.jpg?crop=1%3A1",
      "profile_url": "http://ooooby.ning.com/profile/HesterRobson"
    },
    "offer_text": " offer:  Seeds -huge variety-Flowers, Veges, Herbs-list availiable on request #seeds in l:Bay View: for  #barter #cash",
    "more_info_url": null,
    "thumbnail": null,
    "end_by": null,
    "end_by_text": null,
    "location": {
      "geo_lat": -39.420207,
      "geo_long": 176.867431,
      "address": "Bay View",
      "tags": [
        {
          "tag": "new_zealand",
          "type": "loc"
        },
        {
          "tag": "hawkes_bay",
          "type": "loc"
        },
        {
          "tag": "bay_view",
          "type": "loc"
        }
      ]
    }
  },
  {
    "message_type": "offer",
    "timestamp": "2010-03-03T21:17:19",
    "tags": [
      {
        "tag": "offer",
        "type": "msg_type"
      },
      {
        "tag": "cheese",
        "type": "tag"
      },
      {
        "tag": "barter",
        "type": "currency"
      },
      {
        "tag": "cash",
        "type": "currency"
      },
      {
        "tag": "ooooby",
        "type": "group"
      },
      {
        "tag": "new_zealand",
        "type": "loc"
      },
      {
        "tag": "nelson",
        "type": "loc"
      }
    ],
    "raw_text": "@ooooby offer:  #Cheese in l:Nelson/Marlborough Can courier anywhere for  #barter #cash until 31/03/2010\nLots of different organic Cheese, including Haloumi, Feta, Camembert, Cheddar etc. ",
    "message_pointer": {
      "provider_name_space": "ooooby",
      "message_id": "0eaf5c45-b27f-4a58-b45f-ff1dec0c8c21"
    },
    "created_by": {
      "type": "OpenSocialUserPointer",
      "provider_user_name": "Liz",
      "provide_name_space": "ooooby",
      "profile_pic_url": "http://api.ning.com/files/BZifzE4LfsmXxWfZHK18tWFbCYm3Oa3pIPCe3ypwaVpgkokxK7jlwxOXYZ590QXkhMbi9Bo1IecBEDGco7Or92U0VPnx02r3/3101_92300119185_806219185_2383053_5143953_n.jpg?crop=1%3A1",
      "profile_url": "http://ooooby.ning.com/profile/Liz110"
    },
    "offer_text": " offer:  #Cheese in l:Nelson/Marlborough Can courier anywhere for  #barter #cash until 31/03/2010\nLots of different organic Cheese, including Haloumi, Feta, Camembert, Cheddar etc. ",
    "more_info_url": null,
    "thumbnail": null,
    "end_by": "2010-03-31T00:00:00",
    "end_by_text": "31/03/2010",
    "location": {
      "geo_lat": -41.270786,
      "geo_long": 173.284,
      "address": "Nelson/Marlborough Can courier anywhere for  #barter #cash until 31/03/2010\nLots of different organic Cheese, including Haloumi, Feta, Camembert, Cheddar etc. ",
      "tags": [
        {
          "tag": "new_zealand",
          "type": "loc"
        },
        {
          "tag": "nelson",
          "type": "loc"
        },
        {
          "tag": "nelson",
          "type": "loc"
        }
      ]
    }
  },
  {
    "message_type": "offer",
    "timestamp": "2010-03-03T15:23:38",
    "tags": [
      {
        "tag": "offer",
        "type": "msg_type"
      },
      {
        "tag": "veges",
        "type": "tag"
      },
      {
        "tag": "barter",
        "type": "currency"
      },
      {
        "tag": "cash",
        "type": "currency"
      },
      {
        "tag": "ooooby",
        "type": "group"
      },
      {
        "tag": "new_zealand",
        "type": "loc"
      },
      {
        "tag": "auckland",
        "type": "loc"
      },
      {
        "tag": "panmure",
        "type": "loc"
      }
    ],
    "raw_text": "@ooooby offer:  ameriHeritage spinich - Howich Historic village (have seed and plants also) #veges in l:Panmure, Auckland, New Zealand: for  #barter #cash until 31/03/2010",
    "message_pointer": {
      "provider_name_space": "ooooby",
      "message_id": "13a336cc-6b67-48e3-a212-03a77737246f"
    },
    "created_by": {
      "type": "OpenSocialUserPointer",
      "provider_user_name": "Angie Gibbons",
      "provide_name_space": "ooooby",
      "profile_pic_url": "http://api.ning.com/files/m-rUv2ZKei5Qo1Jwee64BFFH49M7K0w6XC8TG*Z2LETi1bRE6A70ADpUHAn80TfXcg*1ZIWTgZU87wm-vGUsnayKo*XVp4Rn/119103389.jpeg?crop=1%3A1",
      "profile_url": "http://ooooby.ning.com/profile/Angie"
    },
    "offer_text": " offer:  ameriHeritage spinich - Howich Historic village (have seed and plants also) #veges in l:Panmure, Auckland, New Zealand: for  #barter #cash until 31/03/2010",
    "more_info_url": null,
    "thumbnail": null,
    "end_by": "2010-03-31T00:00:00",
    "end_by_text": "31/03/2010",
    "location": {
      "geo_lat": -36.901258,
      "geo_long": 174.856974,
      "address": "Panmure, Auckland, New Zealand",
      "tags": [
        {
          "tag": "new_zealand",
          "type": "loc"
        },
        {
          "tag": "auckland",
          "type": "loc"
        },
        {
          "tag": "panmure",
          "type": "loc"
        }
      ]
    }
  },
  {
    "message_type": "offer",
    "timestamp": "2010-07-13T14:08:51",
    "tags": [
      {
        "tag": "offer",
        "type": "msg_type"
      },
      {
        "tag": "free",
        "type": "currency"
      },
      {
        "tag": "barter",
        "type": "currency"
      },
      {
        "tag": "ooooby",
        "type": "group"
      },
      {
        "tag": "new_zealand",
        "type": "loc"
      },
      {
        "tag": "auckland",
        "type": "loc"
      },
      {
        "tag": "blockhouse_bay",
        "type": "loc"
      }
    ],
    "raw_text": "@ooooby offer:  Parsley in l:Blockhouse Bay: for  #free #barter\nGiant parsley plant that could feed an army seeks a good haircut. Would love to swap it for whatever you can throw at me but free is fine too",
    "message_pointer": {
      "provider_name_space": "ooooby",
      "message_id": "17110f6a-b66c-4155-b961-f0efae8699a4"
    },
    "created_by": {
      "type": "OpenSocialUserPointer",
      "provider_user_name": "Lara S",
      "provide_name_space": "ooooby",
      "profile_pic_url": "http://api.ning.com/files/LOe-CxVt4XeOnY7Abyec0jArW2VN*IA1*CAumgKd*oahWptQ01nneke03uzO64YqCboTZLPAf7Jd3-Ca*J4-3AeHZb8tIR9WJz18grxpNiQ_/SDC10164.JPG?crop=1%3A1",
      "profile_url": "http://ooooby.ning.com/profile/LaraS"
    },
    "offer_text": " offer:  Parsley in l:Blockhouse Bay: for  #free #barter\nGiant parsley plant that could feed an army seeks a good haircut. Would love to swap it for whatever you can throw at me but free is fine too",
    "more_info_url": null,
    "thumbnail": null,
    "end_by": null,
    "end_by_text": null,
    "location": {
      "geo_lat": -36.916844,
      "geo_long": 174.708759,
      "address": "Blockhouse Bay",
      "tags": [
        {
          "tag": "new_zealand",
          "type": "loc"
        },
        {
          "tag": "auckland",
          "type": "loc"
        },
        {
          "tag": "blockhouse_bay",
          "type": "loc"
        }
      ]
    }
  },
  {
    "message_type": "wanted",
    "timestamp": "2010-08-25T22:46:46",
    "tags": [
      {
        "tag": "wanted",
        "type": "msg_type"
      },
      {
        "tag": "fruit",
        "type": "tag"
      },
      {
        "tag": "free",
        "type": "currency"
      },
      {
        "tag": "barter",
        "type": "currency"
      },
      {
        "tag": "ooooby",
        "type": "group"
      },
      {
        "tag": "new_zealand",
        "type": "loc"
      },
      {
        "tag": "auckland",
        "type": "loc"
      }
    ],
    "raw_text": "@ooooby wanted:  Rhubarb plants #fruit in l:West Auckland: for  #free #barter",
    "message_pointer": {
      "provider_name_space": "ooooby",
      "message_id": "177e63f5-3ed0-43b0-9cd0-8b552f41e971"
    },
    "created_by": {
      "type": "OpenSocialUserPointer",
      "provider_user_name": "Buffie Mawhinney",
      "provide_name_space": "ooooby",
      "profile_pic_url": "http://api.ning.com/files/uTnsLn-ArswXpMnVrl43OTT32MYjRePoXK21Pfhntvb4IzjDwtAu*2qH-wOp-qbStV3T50osl1efLzxa*qH3AU2k5bXdyeggXpaSSz-1JOc_/DSCF0162.JPG?crop=1%3A1",
      "profile_url": "http://ooooby.ning.com/profile/BuffieMawhinney"
    },
    "offer_text": " wanted:  Rhubarb plants #fruit in l:West Auckland: for  #free #barter",
    "more_info_url": null,
    "thumbnail": null,
    "end_by": null,
    "end_by_text": null,
    "location": {
      "geo_lat": -36.847385,
      "geo_long": 174.765735,
      "address": "West Auckland",
      "tags": [
        {
          "tag": "new_zealand",
          "type": "loc"
        },
        {
          "tag": "auckland",
          "type": "loc"
        },
        {
          "tag": "auckland",
          "type": "loc"
        }
      ]
    }
  },
  {
    "message_type": "offer",
    "timestamp": "2010-06-02T07:34:52",
    "tags": [
      {
        "tag": "offer",
        "type": "msg_type"
      },
      {
        "tag": "strawberry",
        "type": "tag"
      },
      {
        "tag": "plants",
        "type": "tag"
      },
      {
        "tag": "waiheke",
        "type": "tag"
      },
      {
        "tag": "cash",
        "type": "currency"
      },
      {
        "tag": "ooooby",
        "type": "group"
      },
      {
        "tag": "australia",
        "type": "loc"
      },
      {
        "tag": "tas",
        "type": "loc"
      },
      {
        "tag": "sandy_bay",
        "type": "loc"
      }
    ],
    "raw_text": "@ooooby offer:  #Strawberry #plants from runners. Delicious large sweet strawberry. 10 for $10. Strawberry plants are $2.50 each on special at the moment. in l:Sandy Bay, #Waiheke Island: for  #cash",
    "message_pointer": {
      "provider_name_space": "ooooby",
      "message_id": "184e83ca-6ec3-4a54-af24-872410af62c7"
    },
    "created_by": {
      "type": "OpenSocialUserPointer",
      "provider_user_name": "Rachel and Andrew Dixie",
      "provide_name_space": "ooooby",
      "profile_pic_url": "http://api.ning.com/files/ngVgq983Y0B9v9OhLIoiV7DCojvcDNCOY9HXs9DiHN-phBap5c48-gtYtxKfClJ2kImGVJG*Adsb08ZLa7*siKn98VBXerT*/2389803221_3522f73c39_o.jpg?crop=1%3A1",
      "profile_url": "http://ooooby.ning.com/profile/RachelDixie"
    },
    "offer_text": " offer:  #Strawberry #plants from runners. Delicious large sweet strawberry. 10 for $10. Strawberry plants are $2.50 each on special at the moment. in l:Sandy Bay, #Waiheke Island: for  #cash",
    "more_info_url": null,
    "thumbnail": null,
    "end_by": null,
    "end_by_text": null,
    "location": {
      "geo_lat": -42.912855,
      "geo_long": 147.354513,
      "address": "Sandy Bay,",
      "tags": [
        {
          "tag": "australia",
          "type": "loc"
        },
        {
          "tag": "tas",
          "type": "loc"
        },
        {
          "tag": "sandy_bay",
          "type": "loc"
        }
      ]
    }
  },
  {
    "message_type": "offer",
    "timestamp": "2010-03-03T07:53:23",
    "tags": [
      {
        "tag": "offer",
        "type": "msg_type"
      },
      {
        "tag": "seedlings",
        "type": "tag"
      },
      {
        "tag": "barter",
        "type": "currency"
      },
      {
        "tag": "cash",
        "type": "currency"
      },
      {
        "tag": "ooooby",
        "type": "group"
      },
      {
        "tag": "new_zealand",
        "type": "loc"
      }
    ],
    "raw_text": "@ooooby offer:  Horse Radish plants - And I can show you how to make the BEST HR Sauce! #seedlings in l:Tawa St, Waiheke: for  #barter #cash until 31/03/2010",
    "message_pointer": {
      "provider_name_space": "ooooby",
      "message_id": "192f332b-2f7e-4175-8bc3-27a6476d6919"
    },
    "created_by": {
      "type": "OpenSocialUserPointer",
      "provider_user_name": "James Samuel",
      "provide_name_space": "ooooby",
      "profile_pic_url": "http://api.ning.com/files/v3Rd0puud3Er-vcIf0dKfxL8GWZa-iuL*6WCNg2C4cNS-*HuUvJNXwmUXCfDrSlqFsXuiK5-x35vHu5Xf5Y6Bg02deXtmjKZ/759825080.jpeg?crop=1%3A1",
      "profile_url": "http://ooooby.ning.com/profile/JamesSamuel"
    },
    "offer_text": " offer:  Horse Radish plants - And I can show you how to make the BEST HR Sauce! #seedlings in l:Tawa St, Waiheke: for  #barter #cash until 31/03/2010",
    "more_info_url": null,
    "thumbnail": null,
    "end_by": "2010-03-31T00:00:00",
    "end_by_text": "31/03/2010",
    "location": {
      "geo_lat": -36.786622,
      "geo_long": 175.019286,
      "address": "Tawa St, Waiheke",
      "tags": [
        {
          "tag": "new_zealand",
          "type": "loc"
        }
      ]
    }
  },
 {
    "message_type": "offer",
    "timestamp": "2010-03-03T08:40:23",
    "tags": [
      {
        "tag": "offer",
        "type": "msg_type"
      },
      {
        "tag": "free",
        "type": "currency"
      },
      {
        "tag": "barter",
        "type": "currency"
      },
      {
        "tag": "cash",
        "type": "currency"
      },
      {
        "tag": "ooooby",
        "type": "group"
      },
      {
        "tag": "new_zealand",
        "type": "loc"
      },
      {
        "tag": "auckland",
        "type": "loc"
      },
      {
        "tag": "ostend",
        "type": "loc"
      }
    ],
    "raw_text": "@ooooby wanted:  Choc mint, peppermint & spearmint herbs in l:Ostend, Waiheke Island: for  #free #barter #cash until 01/06/2010",
    "message_pointer": {
      "provider_name_space": "ooooby",
      "message_id": "2193af8e-440e-4fd0-88aa-b71271299b82"
    },
    "created_by": {
      "type": "OpenSocialUserPointer",
      "provider_user_name": "Katherine",
      "provide_name_space": "ooooby",
      "profile_pic_url": "http://api.ning.com/files/aAMmOT3TUE7dPtDKt*pOw-bCW5E1Fgi5a0-tcW-srqRDyYjMhXoeBd-6fCQsRTgO79crNvOT*DapPGWTl*HHFNx30aNGramz/PB290081.JPG?crop=1%3A1",
      "profile_url": "http://ooooby.ning.com/profile/Katherine"
    },
    "offer_text": " wanted:  Choc mint, peppermint & spearmint herbs in l:Ostend, Waiheke Island: for  #free #barter #cash until 01/06/2010",
    "more_info_url": null,
    "thumbnail": null,
    "end_by": "2010-06-01T00:00:00",
    "end_by_text": "01/06/2010",
    "location": {
      "geo_lat": -36.795923,
      "geo_long": 175.048087,
      "address": "Ostend, Waiheke Island",
      "tags": [
        {
          "tag": "new_zealand",
          "type": "loc"
        },
        {
          "tag": "auckland",
          "type": "loc"
        },
        {
          "tag": "ostend",
          "type": "loc"
        }
      ]
    }
  },
  {
    "message_type": "offer",
    "timestamp": "2010-03-05T07:28:30",
    "tags": [
      {
        "tag": "offer",
        "type": "msg_type"
      },
      {
        "tag": "seeds",
        "type": "tag"
      },
      {
        "tag": "free",
        "type": "currency"
      },
      {
        "tag": "barter",
        "type": "currency"
      },
      {
        "tag": "ooooby",
        "type": "group"
      },
      {
        "tag": "new_zealand",
        "type": "loc"
      },
      {
        "tag": "auckland",
        "type": "loc"
      },
      {
        "tag": "western_springs",
        "type": "loc"
      }
    ],
    "raw_text": "@ooooby offer:  #seeds - lettuce, marigold, calendula and rocket in l:Western Springs: for  #free #barter until 14/03/2010",
    "message_pointer": {
      "provider_name_space": "ooooby",
      "message_id": "281f0582-5359-40c7-8381-0560a2806945"
    },
    "created_by": {
      "type": "OpenSocialUserPointer",
      "provider_user_name": "Ariane Craig Smith",
      "provide_name_space": "ooooby",
      "profile_pic_url": "http://api.ning.com/files/V5LpaUTfrTLyNoJRWyXPD-gaxd1B5cTupsfWrEc10em*rvKxdcCEV9xleZLMlMrdl0ArXCdUGkHoxYhTcecSNnuCyVF86HzO/100_2166.JPG?crop=1%3A1",
      "profile_url": "http://ooooby.ning.com/profile/ArianeCraigSmith"
    },
    "offer_text": " offer:  #seeds - lettuce, marigold, calendula and rocket in l:Western Springs: for  #free #barter until 14/03/2010",
    "more_info_url": null,
    "thumbnail": null,
    "end_by": "2010-03-14T00:00:00",
    "end_by_text": "14/03/2010",
    "location": {
      "geo_lat": -36.868164,
      "geo_long": 174.72549,
      "address": "Western Springs",
      "tags": [
        {
          "tag": "new_zealand",
          "type": "loc"
        },
        {
          "tag": "auckland",
          "type": "loc"
        },
        {
          "tag": "western_springs",
          "type": "loc"
        }
      ]
    }
  },
  {
    "message_type": "offer",
    "timestamp": "2010-03-29T22:18:38",
    "tags": [
      {
        "tag": "offer",
        "type": "msg_type"
      },
      {
        "tag": "tools",
        "type": "tag"
      },
      {
        "tag": "free",
        "type": "currency"
      },
      {
        "tag": "ooooby",
        "type": "group"
      },
      {
        "tag": "new_zealand",
        "type": "loc"
      },
      {
        "tag": "northland",
        "type": "loc"
      },
      {
        "tag": "tikipunga",
        "type": "loc"
      }
    ],
    "raw_text": "@ooooby offer:  Skill saw to lend - its old and heavy but goes. #tools and implements in l:Tikipunga: for  #free",
    "message_pointer": {
      "provider_name_space": "ooooby",
      "message_id": "29685964-afd5-4799-b616-187f71195ba4"
    },
    "created_by": {
      "type": "OpenSocialUserPointer",
      "provider_user_name": "Myles Green",
      "provide_name_space": "ooooby",
      "profile_pic_url": "http://api.ning.com/files/1asojdz*InyjiX7F*p-cFPxV*9vQ3MesUA3cBJ8ggc2WY0MftGVeOSsFi7c4cv6m7hgbxRdf*N25ICWRPgLuXc15A-go1v1j/bb.jpg?crop=1%3A1",
      "profile_url": "http://ooooby.ning.com/profile/MylesGreen"
    },
    "offer_text": " offer:  Skill saw to lend - its old and heavy but goes. #tools and implements in l:Tikipunga: for  #free",
    "more_info_url": null,
    "thumbnail": null,
    "end_by": null,
    "end_by_text": null,
    "location": {
      "geo_lat": -35.684878,
      "geo_long": 174.328528,
      "address": "Tikipunga",
      "tags": [
        {
          "tag": "new_zealand",
          "type": "loc"
        },
        {
          "tag": "northland",
          "type": "loc"
        },
        {
          "tag": "tikipunga",
          "type": "loc"
        }
      ]
    }
  },
  {
    "message_type": "wanted",
    "timestamp": "2010-05-15T22:58:14",
    "tags": [
      {
        "tag": "wanted",
        "type": "msg_type"
      },
      {
        "tag": "cash",
        "type": "currency"
      },
      {
        "tag": "ooooby",
        "type": "group"
      },
      {
        "tag": "new_zealand",
        "type": "loc"
      },
      {
        "tag": "marlborough",
        "type": "loc"
      },
      {
        "tag": "blenheim",
        "type": "loc"
      }
    ],
    "raw_text": "@ooooby wanted:  Marionberry plant in l:Blenheim: for  #cash",
    "message_pointer": {
      "provider_name_space": "ooooby",
      "message_id": "2ad6bf4e-03e1-4500-bcfd-2d70c3d99dbe"
    },
    "created_by": {
      "type": "OpenSocialUserPointer",
      "provider_user_name": "You",
      "provide_name_space": "ooooby",
      "profile_pic_url": "undefined",
      "profile_url": "undefined"
    },
    "offer_text": " wanted:  Marionberry plant in l:Blenheim: for  #cash",
    "more_info_url": null,
    "thumbnail": null,
    "end_by": null,
    "end_by_text": null,
    "location": {
      "geo_lat": -41.516457,
      "geo_long": 173.953239,
      "address": "Blenheim",
      "tags": [
        {
          "tag": "new_zealand",
          "type": "loc"
        },
        {
          "tag": "marlborough",
          "type": "loc"
        },
        {
          "tag": "blenheim",
          "type": "loc"
        }
      ]
    }
  },
  {
    "message_type": "wanted",
    "timestamp": "2010-09-21T05:24:25",
    "tags": [
      {
        "tag": "wanted",
        "type": "msg_type"
      },
      {
        "tag": "seedlings",
        "type": "tag"
      },
      {
        "tag": "egyptian",
        "type": "tag"
      },
      {
        "tag": "seeds",
        "type": "tag"
      },
      {
        "tag": "free",
        "type": "currency"
      },
      {
        "tag": "barter",
        "type": "currency"
      },
      {
        "tag": "ooooby",
        "type": "group"
      },
      {
        "tag": "new_zealand",
        "type": "loc"
      },
      {
        "tag": "waikato",
        "type": "loc"
      },
      {
        "tag": "te_awamutu",
        "type": "loc"
      }
    ],
    "raw_text": "@ooooby wanted:  Egyptian Onion/s  #seedlings  - will pay postage. #Egyptian Onion #Egyptian Onion #seeds in l:Te Awamutu: for  #free #barter until 31/10/2010",
    "message_pointer": {
      "provider_name_space": "ooooby",
      "message_id": "31643076-d2c1-4556-8024-f067318db35f"
    },
    "created_by": {
      "type": "OpenSocialUserPointer",
      "provider_user_name": "Anna Holmes",
      "provide_name_space": "ooooby",
      "profile_pic_url": "http://api.ning.com/files/Abj6oQn693STtVpNku*Z-Zu7VmpHs6yn9pzPQlMWDECRUjSKSUUe*dMYnVqZiWqo7U0kSglDA7pjF8RGVs7N75oojqKUDEm5GNu0eOqC1H4_/NovDec08053.jpg?crop=1%3A1",
      "profile_url": "http://ooooby.ning.com/profile/AnnaMarieHolmes"
    },
    "offer_text": " wanted:  Egyptian Onion/s  #seedlings  - will pay postage. #Egyptian Onion #Egyptian Onion #seeds in l:Te Awamutu: for  #free #barter until 31/10/2010",
    "more_info_url": null,
    "thumbnail": null,
    "end_by": "2010-10-31T00:00:00",
    "end_by_text": "31/10/2010",
    "location": {
      "geo_lat": -38.009598,
      "geo_long": 175.324179,
      "address": "Te Awamutu",
      "tags": [
        {
          "tag": "new_zealand",
          "type": "loc"
        },
        {
          "tag": "waikato",
          "type": "loc"
        },
        {
          "tag": "te_awamutu",
          "type": "loc"
        }
      ]
    }
  },
 {
    "message_type": "offer",
    "timestamp": "2010-07-13T14:08:36",
    "tags": [
      {
        "tag": "offer",
        "type": "msg_type"
      },
      {
        "tag": "free",
        "type": "currency"
      },
      {
        "tag": "barter",
        "type": "currency"
      },
      {
        "tag": "ooooby",
        "type": "group"
      },
      {
        "tag": "new_zealand",
        "type": "loc"
      },
      {
        "tag": "auckland",
        "type": "loc"
      },
      {
        "tag": "blockhouse_bay",
        "type": "loc"
      }
    ],
    "raw_text": "@ooooby offer:  Parsley in l:Blockhouse Bay: for  #free #barter\nGiant parsley plant that could feed an army seeks a good haircut. Would love to swap it for whatever you can throw at me but free is fine too",
    "message_pointer": {
      "provider_name_space": "ooooby",
      "message_id": "32dc919e-fdbd-44a6-8ce9-88935781e73c"
    },
    "created_by": {
      "type": "OpenSocialUserPointer",
      "provider_user_name": "Lara S",
      "provide_name_space": "ooooby",
      "profile_pic_url": "http://api.ning.com/files/LOe-CxVt4XeOnY7Abyec0jArW2VN*IA1*CAumgKd*oahWptQ01nneke03uzO64YqCboTZLPAf7Jd3-Ca*J4-3AeHZb8tIR9WJz18grxpNiQ_/SDC10164.JPG?crop=1%3A1",
      "profile_url": "http://ooooby.ning.com/profile/LaraS"
    },
    "offer_text": " offer:  Parsley in l:Blockhouse Bay: for  #free #barter\nGiant parsley plant that could feed an army seeks a good haircut. Would love to swap it for whatever you can throw at me but free is fine too",
    "more_info_url": null,
    "thumbnail": null,
    "end_by": null,
    "end_by_text": null,
    "location": {
      "geo_lat": -36.916844,
      "geo_long": 174.708759,
      "address": "Blockhouse Bay",
      "tags": [
        {
          "tag": "new_zealand",
          "type": "loc"
        },
        {
          "tag": "auckland",
          "type": "loc"
        },
        {
          "tag": "blockhouse_bay",
          "type": "loc"
        }
      ]
    }
  },
  {
    "message_type": "offer",
    "timestamp": "2010-03-03T21:46:42",
    "tags": [
      {
        "tag": "offer",
        "type": "msg_type"
      },
      {
        "tag": "compost",
        "type": "tag"
      },
      {
        "tag": "free",
        "type": "currency"
      },
      {
        "tag": "barter",
        "type": "currency"
      },
      {
        "tag": "ooooby",
        "type": "group"
      },
      {
        "tag": "new_zealand",
        "type": "loc"
      },
      {
        "tag": "auckland",
        "type": "loc"
      },
      {
        "tag": "parnell",
        "type": "loc"
      }
    ],
    "raw_text": "@ooooby offer:  Bokashi #compost - available periodically, contact me if interested in l:Parnell, Auckland: for  #free #barter",
    "message_pointer": {
      "provider_name_space": "ooooby",
      "message_id": "36b04a8e-f898-4ce3-928f-677dfd9e6616"
    },
    "created_by": {
      "type": "OpenSocialUserPointer",
      "provider_user_name": "Emily Harris",
      "provide_name_space": "ooooby",
      "profile_pic_url": "http://api.ning.com/files/3bWYqEHQmNYG0nkVYurjoM1scgOna4p2A2FpCY8zBX0SubPpAcJattRAHGsD-4Sen6JlJH9gnaS9wTSCDVj0ZV-k6ZQqBe*O/IMG_2585.JPG?crop=1%3A1",
      "profile_url": "http://ooooby.ning.com/profile/EmilyHarris"
    },
    "offer_text": " offer:  Bokashi #compost - available periodically, contact me if interested in l:Parnell, Auckland: for  #free #barter",
    "more_info_url": null,
    "thumbnail": null,
    "end_by": null,
    "end_by_text": null,
    "location": {
      "geo_lat": -36.854976,
      "geo_long": 174.780175,
      "address": "Parnell, Auckland",
      "tags": [
        {
          "tag": "new_zealand",
          "type": "loc"
        },
        {
          "tag": "auckland",
          "type": "loc"
        },
        {
          "tag": "parnell",
          "type": "loc"
        }
      ]
    }
  },
  {
    "message_type": "offer",
    "timestamp": "2010-07-15T03:53:22",
    "tags": [
      {
        "tag": "offer",
        "type": "msg_type"
      },
      {
        "tag": "cash",
        "type": "currency"
      },
      {
        "tag": "ooooby",
        "type": "group"
      },
      {
        "tag": "new_zealand",
        "type": "loc"
      },
      {
        "tag": "auckland",
        "type": "loc"
      },
      {
        "tag": "orewa",
        "type": "loc"
      }
    ],
    "raw_text": "@ooooby offer:  Peru peru ie Maori potato (for seed)  two variety Kowiniwini and Pokahino , kowini has purple marbelling in flesh poka is red skinned .\n10$ kg or trade . in l:Orewa: for  #cash",
    "message_pointer": {
      "provider_name_space": "ooooby",
      "message_id": "399e3c44-2b01-427e-a523-b0ec85fa88f0"
    },
    "created_by": {
      "type": "OpenSocialUserPointer",
      "provider_user_name": "Travis",
      "provide_name_space": "ooooby",
      "profile_pic_url": "http://api.ning.com/files/g57QSoJaXEssLb47RzU1dDolyhQhCZOORA9SRVLBBi7nhtxOCCRUIpLWIO7l*8REm*O8tseheh5-8xTfJ971mm2c*0nHSWuy/IMGP0010.JPG?crop=1%3A1",
      "profile_url": "http://ooooby.ning.com/profile/Travis"
    },
    "offer_text": " offer:  Peru peru ie Maori potato (for seed)  two variety Kowiniwini and Pokahino , kowini has purple marbelling in flesh poka is red skinned .\n10$ kg or trade . in l:Orewa: for  #cash",
    "more_info_url": null,
    "thumbnail": null,
    "end_by": null,
    "end_by_text": null,
    "location": {
      "geo_lat": -36.585703,
      "geo_long": 174.691442,
      "address": "Orewa",
      "tags": [
        {
          "tag": "new_zealand",
          "type": "loc"
        },
        {
          "tag": "auckland",
          "type": "loc"
        },
        {
          "tag": "orewa",
          "type": "loc"
        }
      ]
    }
  },
   {
    "message_type": "offer",
    "timestamp": "2010-03-09T05:16:39",
    "tags": [
      {
        "tag": "offer",
        "type": "msg_type"
      },
      {
        "tag": "seedlings",
        "type": "tag"
      },
      {
        "tag": "fruit",
        "type": "tag"
      },
      {
        "tag": "free",
        "type": "currency"
      },
      {
        "tag": "barter",
        "type": "currency"
      },
      {
        "tag": "ooooby",
        "type": "group"
      },
      {
        "tag": "new_zealand",
        "type": "loc"
      },
      {
        "tag": "canterbury",
        "type": "loc"
      },
      {
        "tag": "springston",
        "type": "loc"
      }
    ],
    "raw_text": "@ooooby offer:  Rosemary Seedlings - Tuscan blue #seedlings. Red Grapes - schuyler #fruit. Comfrey #Seedlings. in l:Springston, canterbury: for  #free #barter until 09/04/2010 ",
    "message_pointer": {
      "provider_name_space": "ooooby",
      "message_id": "3a233d14-5c8c-4fa2-8b5f-e63a09c096f5"
    },
    "created_by": {
      "type": "OpenSocialUserPointer",
      "provider_user_name": "Vivien Field",
      "provide_name_space": "ooooby",
      "profile_pic_url": "http://api.ning.com/files/dK3RWAp*i*6IGW9ha2uClEbGeo8KnuzEhiWCpaNZC0vHeLUJOAEv-XvPnuW4aUDhXhjUAevoWWHlFqPBDdhLRl26XlV8uX-o/family_park.jpg?crop=1%3A1",
      "profile_url": "http://ooooby.ning.com/profile/VivienField"
    },
    "offer_text": " offer:  Rosemary Seedlings - Tuscan blue #seedlings. Red Grapes - schuyler #fruit. Comfrey #Seedlings. in l:Springston, canterbury: for  #free #barter until 09/04/2010 ",
    "more_info_url": null,
    "thumbnail": null,
    "end_by": "2010-04-09T00:00:00",
    "end_by_text": "09/04/2010 ",
    "location": {
      "geo_lat": -43.642739,
      "geo_long": 172.423194,
      "address": "Springston, canterbury",
      "tags": [
        {
          "tag": "new_zealand",
          "type": "loc"
        },
        {
          "tag": "canterbury",
          "type": "loc"
        },
        {
          "tag": "springston",
          "type": "loc"
        }
      ]
    }
  },
   {
    "message_type": "offer",
    "timestamp": "2010-10-26T19:27:58",
    "tags": [
      {
        "tag": "offer",
        "type": "msg_type"
      },
      {
        "tag": "compost",
        "type": "tag"
      },
      {
        "tag": "free",
        "type": "currency"
      },
      {
        "tag": "barter",
        "type": "currency"
      },
      {
        "tag": "ooooby",
        "type": "group"
      },
      {
        "tag": "new_zealand",
        "type": "loc"
      },
      {
        "tag": "auckland",
        "type": "loc"
      },
      {
        "tag": "parnell",
        "type": "loc"
      }
    ],
    "raw_text": "@ooooby offer:  bokashi contents #compost in l:Parnell: for  #free #barter until 20/11/2010",
    "message_pointer": {
      "provider_name_space": "ooooby",
      "message_id": "3b7906a3-15df-4193-ae19-2233e1d10ba0"
    },
    "created_by": {
      "type": "OpenSocialUserPointer",
      "provider_user_name": "Emily Harris",
      "provide_name_space": "ooooby",
      "profile_pic_url": "http://api.ning.com/files/GvCEOLv8p5EU1OsMgHyryDWagMcgpdlxSQpJQY-VIEiwD1gK2qIZhekn1*iJz3vFhUvcUpc3tto-iR3qTBkZw2wBEBcGgqjN/IMG_3334_resized.jpg?crop=1%3A1",
      "profile_url": "http://ooooby.ning.com/profile/EmilyHarris"
    },
    "offer_text": " offer:  bokashi contents #compost in l:Parnell: for  #free #barter until 20/11/2010",
    "more_info_url": null,
    "thumbnail": null,
    "end_by": "2010-11-20T00:00:00",
    "end_by_text": "20/11/2010",
    "location": {
      "geo_lat": -36.854976,
      "geo_long": 174.780175,
      "address": "Parnell",
      "tags": [
        {
          "tag": "new_zealand",
          "type": "loc"
        },
        {
          "tag": "auckland",
          "type": "loc"
        },
        {
          "tag": "parnell",
          "type": "loc"
        }
      ]
    }
  },  
 {
    "message_type": "wanted",
    "timestamp": "2010-05-15T22:58:49",
    "tags": [
      {
        "tag": "wanted",
        "type": "msg_type"
      },
      {
        "tag": "cash",
        "type": "currency"
      },
      {
        "tag": "ooooby",
        "type": "group"
      },
      {
        "tag": "new_zealand",
        "type": "loc"
      },
      {
        "tag": "marlborough",
        "type": "loc"
      },
      {
        "tag": "blenheim",
        "type": "loc"
      }
    ],
    "raw_text": "@ooooby wanted:  Marionberry plant in l:Blenheim: for  #cash",
    "message_pointer": {
      "provider_name_space": "ooooby",
      "message_id": "3f7b8650-5590-434a-90e7-4d4adbde14d6"
    },
    "created_by": {
      "type": "OpenSocialUserPointer",
      "provider_user_name": "You",
      "provide_name_space": "ooooby",
      "profile_pic_url": "undefined",
      "profile_url": "undefined"
    },
    "offer_text": " wanted:  Marionberry plant in l:Blenheim: for  #cash",
    "more_info_url": null,
    "thumbnail": null,
    "end_by": null,
    "end_by_text": null,
    "location": {
      "geo_lat": -41.516457,
      "geo_long": 173.953239,
      "address": "Blenheim",
      "tags": [
        {
          "tag": "new_zealand",
          "type": "loc"
        },
        {
          "tag": "marlborough",
          "type": "loc"
        },
        {
          "tag": "blenheim",
          "type": "loc"
        }
      ]
    }
  },
  {
    "message_type": "offer",
    "timestamp": "2010-03-03T09:10:46",
    "tags": [
      {
        "tag": "offer",
        "type": "msg_type"
      },
      {
        "tag": "barter",
        "type": "currency"
      },
      {
        "tag": "ooooby",
        "type": "group"
      },
      {
        "tag": "new_zealand",
        "type": "loc"
      },
      {
        "tag": "auckland",
        "type": "loc"
      },
      {
        "tag": "kingsland",
        "type": "loc"
      }
    ],
    "raw_text": "@ooooby offer:  Pomegranates. Small windfalls, as they are available - we are already eating them - yummy! in l:Kingsland: for  #barter until 31/03/2010 or as available",
    "message_pointer": {
      "provider_name_space": "ooooby",
      "message_id": "4042437b-e6a4-4a23-bb4b-ec6b5b151686"
    },
    "created_by": {
      "type": "OpenSocialUserPointer",
      "provider_user_name": "Denise",
      "provide_name_space": "ooooby",
      "profile_pic_url": "http://api.ning.com/files/eNL*fHQV-PTdiNbUMkT6kI5BkNz0LCTazOIRsH9IMA3b6kUsCkJjS5rlj*DNfOaEgFeBN-k95otoDrzAmTDnAi89Lq8*rS8i/selflondoncrop.jpg?crop=1%3A1",
      "profile_url": "http://ooooby.ning.com/profile/Denise"
    },
    "offer_text": " offer:  Pomegranates. Small windfalls, as they are available - we are already eating them - yummy! in l:Kingsland: for  #barter until 31/03/2010 or as available",
    "more_info_url": null,
    "thumbnail": null,
    "end_by": "2010-03-31T00:00:00",
    "end_by_text": "31/03/2010",
    "location": {
      "geo_lat": -36.869946,
      "geo_long": 174.746691,
      "address": "Kingsland",
      "tags": [
        {
          "tag": "new_zealand",
          "type": "loc"
        },
        {
          "tag": "auckland",
          "type": "loc"
        },
        {
          "tag": "kingsland",
          "type": "loc"
        }
      ]
    }
  },
  {
    "message_type": "offer",
    "timestamp": "2010-03-04T07:16:22",
    "tags": [
      {
        "tag": "offer",
        "type": "msg_type"
      },
      {
        "tag": "barter",
        "type": "currency"
      },
      {
        "tag": "ooooby",
        "type": "group"
      },
      {
        "tag": "new_zealand",
        "type": "loc"
      },
      {
        "tag": "waikato",
        "type": "loc"
      },
      {
        "tag": "raglan",
        "type": "loc"
      }
    ],
    "raw_text": "@ooooby offer:  weeding/tidying garden, or picking fruit, in exchange for fruit (either bottling or eating). in l:Raglan (North Island): for  #barter",
    "message_pointer": {
      "provider_name_space": "ooooby",
      "message_id": "428c24ac-f40f-41a1-aaf9-5540d4eebd39"
    },
    "created_by": {
      "type": "OpenSocialUserPointer",
      "provider_user_name": "Karen Mooar",
      "provide_name_space": "ooooby",
      "profile_pic_url": "http://api.ning.com/files/8Z887*-NWUKw06dmcFwXZjEPsxcgwNtqu7bbtdZw-noqKsDpfGziV227bFwvAWMK5Gn5v5wx6h-wmDTITou1DmreXrmMMLbX/karen09.jpg?crop=1%3A1",
      "profile_url": "http://ooooby.ning.com/profile/KarenMooar"
    },
    "offer_text": " offer:  weeding/tidying garden, or picking fruit, in exchange for fruit (either bottling or eating). in l:Raglan (North Island): for  #barter",
    "more_info_url": null,
    "thumbnail": null,
    "end_by": null,
    "end_by_text": null,
    "location": {
      "geo_lat": -37.802571,
      "geo_long": 174.872606,
      "address": "Raglan (North Island)",
      "tags": [
        {
          "tag": "new_zealand",
          "type": "loc"
        },
        {
          "tag": "waikato",
          "type": "loc"
        },
        {
          "tag": "raglan",
          "type": "loc"
        }
      ]
    }
  },
  {
    "message_type": "wanted",
    "timestamp": "2010-09-21T03:23:02",
    "tags": [
      {
        "tag": "wanted",
        "type": "msg_type"
      },
      {
        "tag": "garden_supplies",
        "type": "tag"
      },
      {
        "tag": "free",
        "type": "currency"
      },
      {
        "tag": "barter",
        "type": "currency"
      },
      {
        "tag": "ooooby",
        "type": "group"
      },
      {
        "tag": "new_zealand",
        "type": "loc"
      },
      {
        "tag": "auckland",
        "type": "loc"
      },
      {
        "tag": "waitakere",
        "type": "loc"
      }
    ],
    "raw_text": "@ooooby wanted:  Second hand gardening tools for the community garden #garden_supplies in l:Ranui: for  #free #barter",
    "message_pointer": {
      "provider_name_space": "ooooby",
      "message_id": "42fd32cf-9225-446f-a1f3-b537bc511d2e"
    },
    "created_by": {
      "type": "OpenSocialUserPointer",
      "provider_user_name": "Buffie Mawhinney",
      "provide_name_space": "ooooby",
      "profile_pic_url": "http://api.ning.com/files/uTnsLn-ArswXpMnVrl43OTT32MYjRePoXK21Pfhntvb4IzjDwtAu*2qH-wOp-qbStV3T50osl1efLzxa*qH3AU2k5bXdyeggXpaSSz-1JOc_/DSCF0162.JPG?crop=1%3A1",
      "profile_url": "http://ooooby.ning.com/profile/BuffieMawhinney"
    },
    "offer_text": " wanted:  Second hand gardening tools for the community garden #garden_supplies in l:Ranui: for  #free #barter",
    "more_info_url": null,
    "thumbnail": null,
    "end_by": null,
    "end_by_text": null,
    "location": {
      "geo_lat": -36.85121,
      "geo_long": 174.543592,
      "address": "Ranui",
      "tags": [
        {
          "tag": "new_zealand",
          "type": "loc"
        },
        {
          "tag": "auckland",
          "type": "loc"
        },
        {
          "tag": "waitakere",
          "type": "loc"
        }
      ]
    }
  },
 {
    "message_type": "offer",
    "timestamp": "2010-03-04T02:28:26",
    "tags": [
      {
        "tag": "offer",
        "type": "msg_type"
      },
      {
        "tag": "garden_services",
        "type": "tag"
      },
      {
        "tag": "advice",
        "type": "tag"
      },
      {
        "tag": "barter",
        "type": "currency"
      },
      {
        "tag": "ooooby",
        "type": "group"
      },
      {
        "tag": "new_zealand",
        "type": "loc"
      },
      {
        "tag": "hawkes_bay",
        "type": "loc"
      },
      {
        "tag": "napier",
        "type": "loc"
      }
    ],
    "raw_text": "@ooooby offer:  Garden Mentoring #garden_services #advice in l:Napier: for  #barter",
    "message_pointer": {
      "provider_name_space": "ooooby",
      "message_id": "455a584d-b204-4c9b-9128-ef5440dc1f11"
    },
    "created_by": {
      "type": "OpenSocialUserPointer",
      "provider_user_name": "Hester Robson",
      "provide_name_space": "ooooby",
      "profile_pic_url": "http://api.ning.com/files/LiiijI5B2KqLmbx6YV8E64cSlUvelp6Tp3L4R4besCGebyXLjrm*hBYuUc44ivTCa-c4Is5TPE513BAI6ci8NCjafZPjpQML/OscarMesmall.jpg?crop=1%3A1",
      "profile_url": "http://ooooby.ning.com/profile/HesterRobson"
    },
    "offer_text": " offer:  Garden Mentoring #garden_services #advice in l:Napier: for  #barter",
    "more_info_url": null,
    "thumbnail": null,
    "end_by": null,
    "end_by_text": null,
    "location": {
      "geo_lat": -39.491733,
      "geo_long": 176.916281,
      "address": "Napier",
      "tags": [
        {
          "tag": "new_zealand",
          "type": "loc"
        },
        {
          "tag": "hawkes_bay",
          "type": "loc"
        },
        {
          "tag": "napier",
          "type": "loc"
        }
      ]
    }
  },
  {
    "message_type": "offer",
    "timestamp": "2010-05-16T06:42:24",
    "tags": [
      {
        "tag": "offer",
        "type": "msg_type"
      },
      {
        "tag": "fruit",
        "type": "tag"
      },
      {
        "tag": "barter",
        "type": "currency"
      },
      {
        "tag": "ooooby",
        "type": "group"
      },
      {
        "tag": "new_zealand",
        "type": "loc"
      }
    ],
    "raw_text": "@ooooby offer:  delicious tree ripened limes, trade anything edible, or services for the garden - really need someone to cut a 2-3m tree down! #fruit in l:Kingsland/Eden park: for  #barter until 31/05/2010",
    "message_pointer": {
      "provider_name_space": "ooooby",
      "message_id": "45fbd896-2c9a-4c75-8e44-92575aa130cb"
    },
    "created_by": {
      "type": "OpenSocialUserPointer",
      "provider_user_name": "Denise",
      "provide_name_space": "ooooby",
      "profile_pic_url": "http://api.ning.com/files/eNL*fHQV-PTdiNbUMkT6kI5BkNz0LCTazOIRsH9IMA3b6kUsCkJjS5rlj*DNfOaEgFeBN-k95otoDrzAmTDnAi89Lq8*rS8i/selflondoncrop.jpg?crop=1%3A1",
      "profile_url": "http://ooooby.ning.com/profile/Denise"
    },
    "offer_text": " offer:  delicious tree ripened limes, trade anything edible, or services for the garden - really need someone to cut a 2-3m tree down! #fruit in l:Kingsland/Eden park: for  #barter until 31/05/2010",
    "more_info_url": null,
    "thumbnail": null,
    "end_by": "2010-05-31T00:00:00",
    "end_by_text": "31/05/2010",
    "location": {
      "geo_lat": -36.875,
      "geo_long": 174.7447222,
      "address": "Kingsland/Eden park",
      "tags": [
        {
          "tag": "new_zealand",
          "type": "loc"
        }
      ]
    }
  },
  {
    "message_type": "wanted",
    "timestamp": "2010-03-04T02:30:02",
    "tags": [
      {
        "tag": "wanted",
        "type": "msg_type"
      },
      {
        "tag": "garden_services",
        "type": "tag"
      },
      {
        "tag": "barter",
        "type": "currency"
      },
      {
        "tag": "ooooby",
        "type": "group"
      },
      {
        "tag": "new_zealand",
        "type": "loc"
      },
      {
        "tag": "hawkes_bay",
        "type": "loc"
      },
      {
        "tag": "bay_view",
        "type": "loc"
      }
    ],
    "raw_text": "@ooooby wanted:  Gardening assistance-weeding, clearing, maintenance #garden_services in l:Bay View: for  #barter",
    "message_pointer": {
      "provider_name_space": "ooooby",
      "message_id": "4b1bc42e-b423-4f81-a970-6a3bdb990b42"
    },
    "created_by": {
      "type": "OpenSocialUserPointer",
      "provider_user_name": "Hester Robson",
      "provide_name_space": "ooooby",
      "profile_pic_url": "http://api.ning.com/files/LiiijI5B2KqLmbx6YV8E64cSlUvelp6Tp3L4R4besCGebyXLjrm*hBYuUc44ivTCa-c4Is5TPE513BAI6ci8NCjafZPjpQML/OscarMesmall.jpg?crop=1%3A1",
      "profile_url": "http://ooooby.ning.com/profile/HesterRobson"
    },
    "offer_text": " wanted:  Gardening assistance-weeding, clearing, maintenance #garden_services in l:Bay View: for  #barter",
    "more_info_url": null,
    "thumbnail": null,
    "end_by": null,
    "end_by_text": null,
    "location": {
      "geo_lat": -39.420207,
      "geo_long": 176.867431,
      "address": "Bay View",
      "tags": [
        {
          "tag": "new_zealand",
          "type": "loc"
        },
        {
          "tag": "hawkes_bay",
          "type": "loc"
        },
        {
          "tag": "bay_view",
          "type": "loc"
        }
      ]
    }
  },
  {
    "message_type": "offer",
    "timestamp": "2010-03-06T22:47:40",
    "tags": [
      {
        "tag": "offer",
        "type": "msg_type"
      },
      {
        "tag": "cultures",
        "type": "tag"
      },
      {
        "tag": "barter",
        "type": "currency"
      },
      {
        "tag": "cash",
        "type": "currency"
      },
      {
        "tag": "ooooby",
        "type": "group"
      },
      {
        "tag": "new_zealand",
        "type": "loc"
      },
      {
        "tag": "auckland",
        "type": "loc"
      },
      {
        "tag": "mount_albert",
        "type": "loc"
      }
    ],
    "raw_text": "@ooooby offer:  Cultures- Sourdough Starter, Caspian Sea Yogurt, Water Kefir Grains, Milk Kefir Grains, Kombucha #Cultures in l:Mt Albert: for  #barter #cash until 31/03/2010",
    "message_pointer": {
      "provider_name_space": "ooooby",
      "message_id": "4c15cc4b-4da4-427e-98d8-dc53c11cd5b1"
    },
    "created_by": {
      "type": "OpenSocialUserPointer",
      "provider_user_name": "Kylie Thomas",
      "provide_name_space": "ooooby",
      "profile_pic_url": "http://api.ning.com/files/EssCt4WW*0rHjJjm0GhmZLk8myghJBdrgIxJy3PY3bfHMEU8jZv5ZZHbgKG99mzbx6VIjHmXDt3Plup9INPyuvvUIOgjy0cW/P1000955.JPG?crop=1%3A1",
      "profile_url": "http://ooooby.ning.com/profile/KylieThomas"
    },
    "offer_text": " offer:  Cultures- Sourdough Starter, Caspian Sea Yogurt, Water Kefir Grains, Milk Kefir Grains, Kombucha #Cultures in l:Mt Albert: for  #barter #cash until 31/03/2010",
    "more_info_url": null,
    "thumbnail": null,
    "end_by": "2010-03-31T00:00:00",
    "end_by_text": "31/03/2010",
    "location": {
      "geo_lat": -36.884061,
      "geo_long": 174.71555,
      "address": "Mt Albert",
      "tags": [
        {
          "tag": "new_zealand",
          "type": "loc"
        },
        {
          "tag": "auckland",
          "type": "loc"
        },
        {
          "tag": "mount_albert",
          "type": "loc"
        }
      ]
    }
  },
  {
    "message_type": "wanted",
    "timestamp": "2010-03-04T02:31:34",
    "tags": [
      {
        "tag": "wanted",
        "type": "msg_type"
      },
      {
        "tag": "nuts",
        "type": "tag"
      },
      {
        "tag": "free",
        "type": "currency"
      },
      {
        "tag": "barter",
        "type": "currency"
      },
      {
        "tag": "cash",
        "type": "currency"
      },
      {
        "tag": "ooooby",
        "type": "group"
      },
      {
        "tag": "new_zealand",
        "type": "loc"
      },
      {
        "tag": "hawkes_bay",
        "type": "loc"
      },
      {
        "tag": "napier",
        "type": "loc"
      }
    ],
    "raw_text": "@ooooby wanted:  Walnuts, Hazelnuts,Macadamia Nuts #nuts in l:Napier: for  #free #barter #cash",
    "message_pointer": {
      "provider_name_space": "ooooby",
      "message_id": "4c859a33-e209-47a4-b56a-9d4eb2bf0ddf"
    },
    "created_by": {
      "type": "OpenSocialUserPointer",
      "provider_user_name": "Hester Robson",
      "provide_name_space": "ooooby",
      "profile_pic_url": "http://api.ning.com/files/LiiijI5B2KqLmbx6YV8E64cSlUvelp6Tp3L4R4besCGebyXLjrm*hBYuUc44ivTCa-c4Is5TPE513BAI6ci8NCjafZPjpQML/OscarMesmall.jpg?crop=1%3A1",
      "profile_url": "http://ooooby.ning.com/profile/HesterRobson"
    },
    "offer_text": " wanted:  Walnuts, Hazelnuts,Macadamia Nuts #nuts in l:Napier: for  #free #barter #cash",
    "more_info_url": null,
    "thumbnail": null,
    "end_by": null,
    "end_by_text": null,
    "location": {
      "geo_lat": -39.491733,
      "geo_long": 176.916281,
      "address": "Napier",
      "tags": [
        {
          "tag": "new_zealand",
          "type": "loc"
        },
        {
          "tag": "hawkes_bay",
          "type": "loc"
        },
        {
          "tag": "napier",
          "type": "loc"
        }
      ]
    }
  },
  {
    "message_type": "offer",
    "timestamp": "2010-03-29T22:43:45",
    "tags": [
      {
        "tag": "offer",
        "type": "msg_type"
      },
      {
        "tag": "veges",
        "type": "tag"
      },
      {
        "tag": "barter",
        "type": "currency"
      },
      {
        "tag": "cash",
        "type": "currency"
      },
      {
        "tag": "ooooby",
        "type": "group"
      },
      {
        "tag": "new_zealand",
        "type": "loc"
      },
      {
        "tag": "auckland",
        "type": "loc"
      },
      {
        "tag": "panmure",
        "type": "loc"
      }
    ],
    "raw_text": "@ooooby offer:  Amaranth leaf  (chinese spinich) #veges\nhttp://en.wikipedia.org/wiki/Amaranth in l:Panmure, auckland: for  #barter #cash until 30/04/2010",
    "message_pointer": {
      "provider_name_space": "ooooby",
      "message_id": "4fe8ea34-1e73-407f-84de-cdc3e112a33b"
    },
    "created_by": {
      "type": "OpenSocialUserPointer",
      "provider_user_name": "Angie Gibbons",
      "provide_name_space": "ooooby",
      "profile_pic_url": "http://api.ning.com/files/m-rUv2ZKei5Qo1Jwee64BFFH49M7K0w6XC8TG*Z2LETi1bRE6A70ADpUHAn80TfXcg*1ZIWTgZU87wm-vGUsnayKo*XVp4Rn/119103389.jpeg?crop=1%3A1",
      "profile_url": "http://ooooby.ning.com/profile/Angie"
    },
    "offer_text": " offer:  Amaranth leaf  (chinese spinich) #veges\nhttp://en.wikipedia.org/wiki/Amaranth in l:Panmure, auckland: for  #barter #cash until 30/04/2010",
    "more_info_url": "http://en.wikipedia.org/wiki/Amaranth",
    "thumbnail": null,
    "end_by": "2010-04-30T00:00:00",
    "end_by_text": "30/04/2010",
    "location": {
      "geo_lat": -36.901258,
      "geo_long": 174.856974,
      "address": "Panmure, auckland",
      "tags": [
        {
          "tag": "new_zealand",
          "type": "loc"
        },
        {
          "tag": "auckland",
          "type": "loc"
        },
        {
          "tag": "panmure",
          "type": "loc"
        }
      ]
    }
  },
  {
    "message_type": "offer",
    "timestamp": "2010-03-04T07:05:08",
    "tags": [
      {
        "tag": "offer",
        "type": "msg_type"
      },
      {
        "tag": "sourdough",
        "type": "tag"
      },
      {
        "tag": "barter",
        "type": "currency"
      },
      {
        "tag": "cash",
        "type": "currency"
      },
      {
        "tag": "ooooby",
        "type": "group"
      },
      {
        "tag": "new_zealand",
        "type": "loc"
      },
      {
        "tag": "waikato",
        "type": "loc"
      },
      {
        "tag": "raglan",
        "type": "loc"
      }
    ],
    "raw_text": "@ooooby offer:  Sourdough bread or starter (wholemeal, home-made) in exchange for fruit. #sourdough bread in l:Raglan (North Island): for  #barter #cash",
    "message_pointer": {
      "provider_name_space": "ooooby",
      "message_id": "52bd89bf-cd3c-45cd-984e-67adb2d8111f"
    },
    "created_by": {
      "type": "OpenSocialUserPointer",
      "provider_user_name": "Karen Mooar",
      "provide_name_space": "ooooby",
      "profile_pic_url": "http://api.ning.com/files/8Z887*-NWUKw06dmcFwXZjEPsxcgwNtqu7bbtdZw-noqKsDpfGziV227bFwvAWMK5Gn5v5wx6h-wmDTITou1DmreXrmMMLbX/karen09.jpg?crop=1%3A1",
      "profile_url": "http://ooooby.ning.com/profile/KarenMooar"
    },
    "offer_text": " offer:  Sourdough bread or starter (wholemeal, home-made) in exchange for fruit. #sourdough bread in l:Raglan (North Island): for  #barter #cash",
    "more_info_url": null,
    "thumbnail": null,
    "end_by": null,
    "end_by_text": null,
    "location": {
      "geo_lat": -37.802571,
      "geo_long": 174.872606,
      "address": "Raglan (North Island)",
      "tags": [
        {
          "tag": "new_zealand",
          "type": "loc"
        },
        {
          "tag": "waikato",
          "type": "loc"
        },
        {
          "tag": "raglan",
          "type": "loc"
        }
      ]
    }
  },
  {
    "message_type": "offer",
    "timestamp": "2010-03-03T08:36:04",
    "tags": [
      {
        "tag": "offer",
        "type": "msg_type"
      },
      {
        "tag": "preserving",
        "type": "tag"
      },
      {
        "tag": "free",
        "type": "currency"
      },
      {
        "tag": "barter",
        "type": "currency"
      },
      {
        "tag": "ooooby",
        "type": "group"
      },
      {
        "tag": "new_zealand",
        "type": "loc"
      },
      {
        "tag": "auckland",
        "type": "loc"
      },
      {
        "tag": "ostend",
        "type": "loc"
      }
    ],
    "raw_text": "@ooooby offer:  Use of a dehydrator to preserve excess fruit, herbs etc #preserving tools in l:ostend, waiheke: for  #free #barter until 01/06/2010",
    "message_pointer": {
      "provider_name_space": "ooooby",
      "message_id": "53b64657-bbf6-4b02-8355-6229bfb855e5"
    },
    "created_by": {
      "type": "OpenSocialUserPointer",
      "provider_user_name": "Katherine",
      "provide_name_space": "ooooby",
      "profile_pic_url": "http://api.ning.com/files/aAMmOT3TUE7dPtDKt*pOw-bCW5E1Fgi5a0-tcW-srqRDyYjMhXoeBd-6fCQsRTgO79crNvOT*DapPGWTl*HHFNx30aNGramz/PB290081.JPG?crop=1%3A1",
      "profile_url": "http://ooooby.ning.com/profile/Katherine"
    },
    "offer_text": " offer:  Use of a dehydrator to preserve excess fruit, herbs etc #preserving tools in l:ostend, waiheke: for  #free #barter until 01/06/2010",
    "more_info_url": null,
    "thumbnail": null,
    "end_by": "2010-06-01T00:00:00",
    "end_by_text": "01/06/2010",
    "location": {
      "geo_lat": -36.795923,
      "geo_long": 175.048087,
      "address": "ostend, waiheke",
      "tags": [
        {
          "tag": "new_zealand",
          "type": "loc"
        },
        {
          "tag": "auckland",
          "type": "loc"
        },
        {
          "tag": "ostend",
          "type": "loc"
        }
      ]
    }
  },
  {
    "message_type": "offer",
    "timestamp": "2010-03-03T07:47:40",
    "tags": [
      {
        "tag": "offer",
        "type": "msg_type"
      },
      {
        "tag": "herbs",
        "type": "tag"
      },
      {
        "tag": "barter",
        "type": "currency"
      },
      {
        "tag": "ooooby",
        "type": "group"
      },
      {
        "tag": "new_zealand",
        "type": "loc"
      }
    ],
    "raw_text": "@ooooby offer:  Stingy Nettle plants #herbs in l:Tawa St, Waiheke: for  #barter until 15/03/2010",
    "message_pointer": {
      "provider_name_space": "ooooby",
      "message_id": "580e0c49-d1ff-4ddf-8743-c77195b56857"
    },
    "created_by": {
      "type": "OpenSocialUserPointer",
      "provider_user_name": "James Samuel",
      "provide_name_space": "ooooby",
      "profile_pic_url": "http://api.ning.com/files/v3Rd0puud3Er-vcIf0dKfxL8GWZa-iuL*6WCNg2C4cNS-*HuUvJNXwmUXCfDrSlqFsXuiK5-x35vHu5Xf5Y6Bg02deXtmjKZ/759825080.jpeg?crop=1%3A1",
      "profile_url": "http://ooooby.ning.com/profile/JamesSamuel"
    },
    "offer_text": " offer:  Stingy Nettle plants #herbs in l:Tawa St, Waiheke: for  #barter until 15/03/2010",
    "more_info_url": null,
    "thumbnail": null,
    "end_by": "2010-03-15T00:00:00",
    "end_by_text": "15/03/2010",
    "location": {
      "geo_lat": -36.786622,
      "geo_long": 175.019286,
      "address": "Tawa St, Waiheke",
      "tags": [
        {
          "tag": "new_zealand",
          "type": "loc"
        }
      ]
    }
  },
  {
    "message_type": "wanted",
    "timestamp": "2010-09-21T05:48:12",
    "tags": [
      {
        "tag": "wanted",
        "type": "msg_type"
      },
      {
        "tag": "waikato",
        "type": "loc"
      },
      {
        "tag": "soil",
        "type": "tag"
      },
      {
        "tag": "free",
        "type": "currency"
      },
      {
        "tag": "barter",
        "type": "currency"
      },
      {
        "tag": "ooooby",
        "type": "group"
      },
      {
        "tag": "new_zealand",
        "type": "loc"
      }
    ],
    "raw_text": "@ooooby wanted:  Clean topsoil to collect - will buy or for free. #Waikato #soil in l:Waikato: for  #free #barter until 31/10/2010",
    "message_pointer": {
      "provider_name_space": "ooooby",
      "message_id": "622669cc-9a3e-4ace-a01b-318f2d0fec6f"
    },
    "created_by": {
      "type": "OpenSocialUserPointer",
      "provider_user_name": "Anna Holmes",
      "provide_name_space": "ooooby",
      "profile_pic_url": "http://api.ning.com/files/Abj6oQn693STtVpNku*Z-Zu7VmpHs6yn9pzPQlMWDECRUjSKSUUe*dMYnVqZiWqo7U0kSglDA7pjF8RGVs7N75oojqKUDEm5GNu0eOqC1H4_/NovDec08053.jpg?crop=1%3A1",
      "profile_url": "http://ooooby.ning.com/profile/AnnaMarieHolmes"
    },
    "offer_text": " wanted:  Clean topsoil to collect - will buy or for free. #Waikato #soil in l:Waikato: for  #free #barter until 31/10/2010",
    "more_info_url": null,
    "thumbnail": null,
    "end_by": "2010-10-31T00:00:00",
    "end_by_text": "31/10/2010",
    "location": {
      "geo_lat": -40.621377,
      "geo_long": 172.678619,
      "address": "Waikato",
      "tags": [
        {
          "tag": "new_zealand",
          "type": "loc"
        },
        {
          "tag": "waikato",
          "type": "loc"
        }
      ]
    }
  },
  {
    "message_type": "offer",
    "timestamp": "2010-07-27T02:30:10",
    "tags": [
      {
        "tag": "offer",
        "type": "msg_type"
      },
      {
        "tag": "cheese",
        "type": "tag"
      },
      {
        "tag": "barter",
        "type": "currency"
      },
      {
        "tag": "cash",
        "type": "currency"
      },
      {
        "tag": "ooooby",
        "type": "group"
      },
      {
        "tag": "new_zealand",
        "type": "loc"
      },
      {
        "tag": "nelson",
        "type": "loc"
      }
    ],
    "raw_text": "@ooooby offer:  Homemade cheese made from organic unpasteurised milk #Cheese in l:Nelson/Blenheim but can freight anywhere: for  #barter #cash until 31/12/2010 All kinds of cheese made to order ",
    "message_pointer": {
      "provider_name_space": "ooooby",
      "message_id": "6bdf72ee-1948-415b-a110-a1a186358dcc"
    },
    "created_by": {
      "type": "OpenSocialUserPointer",
      "provider_user_name": "Liz",
      "provide_name_space": "ooooby",
      "profile_pic_url": "http://api.ning.com/files/BZifzE4LfsmXxWfZHK18tWFbCYm3Oa3pIPCe3ypwaVpgkokxK7jlwxOXYZ590QXkhMbi9Bo1IecBEDGco7Or92U0VPnx02r3/3101_92300119185_806219185_2383053_5143953_n.jpg?crop=1%3A1",
      "profile_url": "http://ooooby.ning.com/profile/Liz110"
    },
    "offer_text": " offer:  Homemade cheese made from organic unpasteurised milk #Cheese in l:Nelson/Blenheim but can freight anywhere: for  #barter #cash until 31/12/2010 All kinds of cheese made to order ",
    "more_info_url": null,
    "thumbnail": null,
    "end_by": null,
    "end_by_text": null,
    "location": {
      "geo_lat": -41.270786,
      "geo_long": 173.284,
      "address": "Nelson/Blenheim but can freight anywhere",
      "tags": [
        {
          "tag": "new_zealand",
          "type": "loc"
        },
        {
          "tag": "nelson",
          "type": "loc"
        },
        {
          "tag": "nelson",
          "type": "loc"
        }
      ]
    }
  },
  {
    "message_type": "offer",
    "timestamp": "2010-09-21T05:15:29",
    "tags": [
      {
        "tag": "offer",
        "type": "msg_type"
      },
      {
        "tag": "mint",
        "type": "tag"
      },
      {
        "tag": "free",
        "type": "currency"
      },
      {
        "tag": "ooooby",
        "type": "group"
      },
      {
        "tag": "new_zealand",
        "type": "loc"
      },
      {
        "tag": "waikato",
        "type": "loc"
      },
      {
        "tag": "te_awamutu",
        "type": "loc"
      }
    ],
    "raw_text": "@ooooby offer:  #mint plants in l:Te Awamutu: for  #free until 16/10/2010",
    "message_pointer": {
      "provider_name_space": "ooooby",
      "message_id": "6cf1db3e-fa54-45cb-a33f-8291095a1c65"
    },
    "created_by": {
      "type": "OpenSocialUserPointer",
      "provider_user_name": "Anna Holmes",
      "provide_name_space": "ooooby",
      "profile_pic_url": "http://api.ning.com/files/Abj6oQn693STtVpNku*Z-Zu7VmpHs6yn9pzPQlMWDECRUjSKSUUe*dMYnVqZiWqo7U0kSglDA7pjF8RGVs7N75oojqKUDEm5GNu0eOqC1H4_/NovDec08053.jpg?crop=1%3A1",
      "profile_url": "http://ooooby.ning.com/profile/AnnaMarieHolmes"
    },
    "offer_text": " offer:  #mint plants in l:Te Awamutu: for  #free until 16/10/2010",
    "more_info_url": null,
    "thumbnail": null,
    "end_by": "2010-10-16T00:00:00",
    "end_by_text": "16/10/2010",
    "location": {
      "geo_lat": -38.009598,
      "geo_long": 175.324179,
      "address": "Te Awamutu",
      "tags": [
        {
          "tag": "new_zealand",
          "type": "loc"
        },
        {
          "tag": "waikato",
          "type": "loc"
        },
        {
          "tag": "te_awamutu",
          "type": "loc"
        }
      ]
    }
  },
  {
    "message_type": "offer",
    "timestamp": "2010-03-03T07:50:25",
    "tags": [
      {
        "tag": "offer",
        "type": "msg_type"
      },
      {
        "tag": "eggs",
        "type": "tag"
      },
      {
        "tag": "chickens",
        "type": "tag"
      },
      {
        "tag": "barter",
        "type": "currency"
      },
      {
        "tag": "cash",
        "type": "currency"
      },
      {
        "tag": "ooooby",
        "type": "group"
      },
      {
        "tag": "new_zealand",
        "type": "loc"
      }
    ],
    "raw_text": "@ooooby offer:  3 healthy mature chickens (2 Bantams +1) that have been laying delicious eggs - we're moving house. #eggs #chickens in l:Tawa St, Waiheke: for  #barter #cash until 31/03/2010",
    "message_pointer": {
      "provider_name_space": "ooooby",
      "message_id": "6f4d81be-0231-4a61-bf0c-6983c79d79bb"
    },
    "created_by": {
      "type": "OpenSocialUserPointer",
      "provider_user_name": "James Samuel",
      "provide_name_space": "ooooby",
      "profile_pic_url": "http://api.ning.com/files/v3Rd0puud3Er-vcIf0dKfxL8GWZa-iuL*6WCNg2C4cNS-*HuUvJNXwmUXCfDrSlqFsXuiK5-x35vHu5Xf5Y6Bg02deXtmjKZ/759825080.jpeg?crop=1%3A1",
      "profile_url": "http://ooooby.ning.com/profile/JamesSamuel"
    },
    "offer_text": " offer:  3 healthy mature chickens (2 Bantams +1) that have been laying delicious eggs - we're moving house. #eggs #chickens in l:Tawa St, Waiheke: for  #barter #cash until 31/03/2010",
    "more_info_url": null,
    "thumbnail": null,
    "end_by": "2010-03-31T00:00:00",
    "end_by_text": "31/03/2010",
    "location": {
      "geo_lat": -36.786622,
      "geo_long": 175.019286,
      "address": "Tawa St, Waiheke",
      "tags": [
        {
          "tag": "new_zealand",
          "type": "loc"
        }
      ]
    }
  },
  {
    "message_type": "wanted",
    "timestamp": "2010-08-25T22:47:48",
    "tags": [
      {
        "tag": "wanted",
        "type": "msg_type"
      },
      {
        "tag": "free",
        "type": "currency"
      },
      {
        "tag": "barter",
        "type": "currency"
      },
      {
        "tag": "ooooby",
        "type": "group"
      },
      {
        "tag": "new_zealand",
        "type": "loc"
      },
      {
        "tag": "auckland",
        "type": "loc"
      }
    ],
    "raw_text": "@ooooby wanted:  Aparagus plants in l:West Auckland: for  #free #barter",
    "message_pointer": {
      "provider_name_space": "ooooby",
      "message_id": "70fe9752-22c0-4c93-b059-689820fe349b"
    },
    "created_by": {
      "type": "OpenSocialUserPointer",
      "provider_user_name": "Buffie Mawhinney",
      "provide_name_space": "ooooby",
      "profile_pic_url": "http://api.ning.com/files/uTnsLn-ArswXpMnVrl43OTT32MYjRePoXK21Pfhntvb4IzjDwtAu*2qH-wOp-qbStV3T50osl1efLzxa*qH3AU2k5bXdyeggXpaSSz-1JOc_/DSCF0162.JPG?crop=1%3A1",
      "profile_url": "http://ooooby.ning.com/profile/BuffieMawhinney"
    },
    "offer_text": " wanted:  Aparagus plants in l:West Auckland: for  #free #barter",
    "more_info_url": null,
    "thumbnail": null,
    "end_by": null,
    "end_by_text": null,
    "location": {
      "geo_lat": -36.847385,
      "geo_long": 174.765735,
      "address": "West Auckland",
      "tags": [
        {
          "tag": "new_zealand",
          "type": "loc"
        },
        {
          "tag": "auckland",
          "type": "loc"
        },
        {
          "tag": "auckland",
          "type": "loc"
        }
      ]
    }
  },
  {
    "message_type": "offer",
    "timestamp": "2010-07-20T08:57:22",
    "tags": [
      {
        "tag": "offer",
        "type": "msg_type"
      },
      {
        "tag": "bee",
        "type": "tag"
      },
      {
        "tag": "cash",
        "type": "currency"
      },
      {
        "tag": "ooooby",
        "type": "group"
      },
      {
        "tag": "new_zealand",
        "type": "loc"
      },
      {
        "tag": "waikato",
        "type": "loc"
      },
      {
        "tag": "hamilton",
        "type": "loc"
      }
    ],
    "raw_text": "@ooooby offer:  Dried and Raw Bee Pollen - Natures Best Superfood!  See www.vitalityonline.co.nz #Bee Pollen in l:Hamilton: for  #cash",
    "message_pointer": {
      "provider_name_space": "ooooby",
      "message_id": "7191565c-b758-469c-8306-377a2c2ffa1a"
    },
    "created_by": {
      "type": "OpenSocialUserPointer",
      "provider_user_name": "You",
      "provide_name_space": "ooooby",
      "profile_pic_url": "undefined",
      "profile_url": "undefined"
    },
    "offer_text": " offer:  Dried and Raw Bee Pollen - Natures Best Superfood!  See www.vitalityonline.co.nz #Bee Pollen in l:Hamilton: for  #cash",
    "more_info_url": null,
    "thumbnail": null,
    "end_by": null,
    "end_by_text": null,
    "location": {
      "geo_lat": -37.788263,
      "geo_long": 175.283883,
      "address": "Hamilton",
      "tags": [
        {
          "tag": "new_zealand",
          "type": "loc"
        },
        {
          "tag": "waikato",
          "type": "loc"
        },
        {
          "tag": "hamilton",
          "type": "loc"
        }
      ]
    }
  },
  {
    "message_type": "wanted",
    "timestamp": "2010-09-21T03:26:22",
    "tags": [
      {
        "tag": "wanted",
        "type": "msg_type"
      },
      {
        "tag": "garden_supplies",
        "type": "tag"
      },
      {
        "tag": "free",
        "type": "currency"
      },
      {
        "tag": "barter",
        "type": "currency"
      },
      {
        "tag": "cash",
        "type": "currency"
      },
      {
        "tag": "ooooby",
        "type": "group"
      },
      {
        "tag": "new_zealand",
        "type": "loc"
      },
      {
        "tag": "auckland",
        "type": "loc"
      },
      {
        "tag": "waitakere",
        "type": "loc"
      }
    ],
    "raw_text": "@ooooby wanted:  Clearlight good condition second hand or seconds for the community garden shade house.  #garden_supplies in l:Ranui: for  #free #barter #cash",
    "message_pointer": {
      "provider_name_space": "ooooby",
      "message_id": "78c4b776-eb0c-41b7-9bd7-6782948b49c5"
    },
    "created_by": {
      "type": "OpenSocialUserPointer",
      "provider_user_name": "Buffie Mawhinney",
      "provide_name_space": "ooooby",
      "profile_pic_url": "http://api.ning.com/files/uTnsLn-ArswXpMnVrl43OTT32MYjRePoXK21Pfhntvb4IzjDwtAu*2qH-wOp-qbStV3T50osl1efLzxa*qH3AU2k5bXdyeggXpaSSz-1JOc_/DSCF0162.JPG?crop=1%3A1",
      "profile_url": "http://ooooby.ning.com/profile/BuffieMawhinney"
    },
    "offer_text": " wanted:  Clearlight good condition second hand or seconds for the community garden shade house.  #garden_supplies in l:Ranui: for  #free #barter #cash",
    "more_info_url": null,
    "thumbnail": null,
    "end_by": null,
    "end_by_text": null,
    "location": {
      "geo_lat": -36.85121,
      "geo_long": 174.543592,
      "address": "Ranui",
      "tags": [
        {
          "tag": "new_zealand",
          "type": "loc"
        },
        {
          "tag": "auckland",
          "type": "loc"
        },
        {
          "tag": "waitakere",
          "type": "loc"
        }
      ]
    }
  },
  {
    "message_type": "offer",
    "timestamp": "2010-03-04T07:50:49",
    "tags": [
      {
        "tag": "offer",
        "type": "msg_type"
      },
      {
        "tag": "food",
        "type": "tag"
      },
      {
        "tag": "barter",
        "type": "currency"
      },
      {
        "tag": "ooooby",
        "type": "group"
      },
      {
        "tag": "new_zealand",
        "type": "loc"
      },
      {
        "tag": "waikato",
        "type": "loc"
      },
      {
        "tag": "nawton",
        "type": "loc"
      }
    ],
    "raw_text": "@ooooby offer:  water keffir grains #food in l:Nawton, Hamilton: for  #barter",
    "message_pointer": {
      "provider_name_space": "ooooby",
      "message_id": "7e8cf136-ce2c-440b-a808-225bb603af7b"
    },
    "created_by": {
      "type": "OpenSocialUserPointer",
      "provider_user_name": "Sarah Walsh",
      "provide_name_space": "ooooby",
      "profile_pic_url": "http://api.ning.com/files/lBZpf7Wkv7q88YC4XvXZ75bgWqmy6cDdktjpLRoCGi3*W9VPsj7r4lI21QnEMIoB31jOHwe5RgpTC1oA1Lj*oAWWwIGEcG9P/SDC10135.JPG?crop=1%3A1",
      "profile_url": "http://ooooby.ning.com/profile/SarahWalsh"
    },
    "offer_text": " offer:  water keffir grains #food in l:Nawton, Hamilton: for  #barter",
    "more_info_url": null,
    "thumbnail": null,
    "end_by": null,
    "end_by_text": null,
    "location": {
      "geo_lat": -37.779811,
      "geo_long": 175.237982,
      "address": "Nawton, Hamilton",
      "tags": [
        {
          "tag": "new_zealand",
          "type": "loc"
        },
        {
          "tag": "waikato",
          "type": "loc"
        },
        {
          "tag": "nawton",
          "type": "loc"
        }
      ]
    }
  },
  {
    "message_type": "offer",
    "timestamp": "2010-03-11T03:32:39",
    "tags": [
      {
        "tag": "offer",
        "type": "msg_type"
      },
      {
        "tag": "fruit",
        "type": "tag"
      },
      {
        "tag": "barter",
        "type": "currency"
      },
      {
        "tag": "cash",
        "type": "currency"
      },
      {
        "tag": "ooooby",
        "type": "group"
      },
      {
        "tag": "new_zealand",
        "type": "loc"
      },
      {
        "tag": "hawkes_bay",
        "type": "loc"
      },
      {
        "tag": "napier",
        "type": "loc"
      }
    ],
    "raw_text": "@ooooby offer:  grapes table-organic, mostly black, some pink. #fruit in l:Napier: for  #barter #cash until 01/04/2010",
    "message_pointer": {
      "provider_name_space": "ooooby",
      "message_id": "838a7638-42be-4648-bc76-d4eebdc2c745"
    },
    "created_by": {
      "type": "OpenSocialUserPointer",
      "provider_user_name": "Hester Robson",
      "provide_name_space": "ooooby",
      "profile_pic_url": "http://api.ning.com/files/LiiijI5B2KqLmbx6YV8E64cSlUvelp6Tp3L4R4besCGebyXLjrm*hBYuUc44ivTCa-c4Is5TPE513BAI6ci8NCjafZPjpQML/OscarMesmall.jpg?crop=1%3A1",
      "profile_url": "http://ooooby.ning.com/profile/HesterRobson"
    },
    "offer_text": " offer:  grapes table-organic, mostly black, some pink. #fruit in l:Napier: for  #barter #cash until 01/04/2010",
    "more_info_url": null,
    "thumbnail": null,
    "end_by": "2010-04-01T00:00:00",
    "end_by_text": "01/04/2010",
    "location": {
      "geo_lat": -39.491733,
      "geo_long": 176.916281,
      "address": "Napier",
      "tags": [
        {
          "tag": "new_zealand",
          "type": "loc"
        },
        {
          "tag": "hawkes_bay",
          "type": "loc"
        },
        {
          "tag": "napier",
          "type": "loc"
        }
      ]
    }
  },
  {
    "message_type": "offer",
    "timestamp": "2010-06-07T22:21:34",
    "tags": [
      {
        "tag": "offer",
        "type": "msg_type"
      },
      {
        "tag": "bulbs",
        "type": "tag"
      },
      {
        "tag": "free",
        "type": "currency"
      },
      {
        "tag": "ooooby",
        "type": "group"
      },
      {
        "tag": "new_zealand",
        "type": "loc"
      },
      {
        "tag": "christchurch",
        "type": "loc"
      }
    ],
    "raw_text": "@ooooby offer:  #Bulbs, Gladioli - plenty of multicoloured varieties ready to plant in l:Springston, Christchurch: for  #free until 01/07/2010",
    "message_pointer": {
      "provider_name_space": "ooooby",
      "message_id": "89ef76b1-df4d-4a8e-b6db-e608c8ccc20d"
    },
    "created_by": {
      "type": "OpenSocialUserPointer",
      "provider_user_name": "Vivien Field",
      "provide_name_space": "ooooby",
      "profile_pic_url": "http://api.ning.com/files/dK3RWAp*i*6IGW9ha2uClEbGeo8KnuzEhiWCpaNZC0vHeLUJOAEv-XvPnuW4aUDhXhjUAevoWWHlFqPBDdhLRl26XlV8uX-o/family_park.jpg?crop=1%3A1",
      "profile_url": "http://ooooby.ning.com/profile/VivienField"
    },
    "offer_text": " offer:  #Bulbs, Gladioli - plenty of multicoloured varieties ready to plant in l:Springston, Christchurch: for  #free until 01/07/2010",
    "more_info_url": null,
    "thumbnail": null,
    "end_by": "2010-07-01T00:00:00",
    "end_by_text": "01/07/2010",
    "location": {
      "geo_lat": -43.624958,
      "geo_long": 172.414122,
      "address": "Springston, Christchurch",
      "tags": [
        {
          "tag": "new_zealand",
          "type": "loc"
        },
        {
          "tag": "christchurch",
          "type": "loc"
        }
      ]
    }
  },
  {
    "message_type": "offer",
    "timestamp": "2010-03-03T08:38:45",
    "tags": [
      {
        "tag": "offer",
        "type": "msg_type"
      },
      {
        "tag": "honey",
        "type": "tag"
      },
      {
        "tag": "free",
        "type": "currency"
      },
      {
        "tag": "barter",
        "type": "currency"
      },
      {
        "tag": "cash",
        "type": "currency"
      },
      {
        "tag": "ooooby",
        "type": "group"
      },
      {
        "tag": "new_zealand",
        "type": "loc"
      },
      {
        "tag": "auckland",
        "type": "loc"
      },
      {
        "tag": "ostend",
        "type": "loc"
      }
    ],
    "raw_text": "@ooooby wanted:  Local honey, regular supply #honey in l:Ostend, Waiheke Island: for  #free #barter #cash until 01/06/2010",
    "message_pointer": {
      "provider_name_space": "ooooby",
      "message_id": "8b2015b9-731f-446f-952c-3c3bee368e38"
    },
    "created_by": {
      "type": "OpenSocialUserPointer",
      "provider_user_name": "Katherine",
      "provide_name_space": "ooooby",
      "profile_pic_url": "http://api.ning.com/files/aAMmOT3TUE7dPtDKt*pOw-bCW5E1Fgi5a0-tcW-srqRDyYjMhXoeBd-6fCQsRTgO79crNvOT*DapPGWTl*HHFNx30aNGramz/PB290081.JPG?crop=1%3A1",
      "profile_url": "http://ooooby.ning.com/profile/Katherine"
    },
    "offer_text": " wanted:  Local honey, regular supply #honey in l:Ostend, Waiheke Island: for  #free #barter #cash until 01/06/2010",
    "more_info_url": null,
    "thumbnail": null,
    "end_by": "2010-06-01T00:00:00",
    "end_by_text": "01/06/2010",
    "location": {
      "geo_lat": -36.795923,
      "geo_long": 175.048087,
      "address": "Ostend, Waiheke Island",
      "tags": [
        {
          "tag": "new_zealand",
          "type": "loc"
        },
        {
          "tag": "auckland",
          "type": "loc"
        },
        {
          "tag": "ostend",
          "type": "loc"
        }
      ]
    }
  },
  {
    "message_type": "offer",
    "timestamp": "2010-07-13T05:24:42",
    "tags": [
      {
        "tag": "offer",
        "type": "msg_type"
      },
      {
        "tag": "free",
        "type": "currency"
      },
      {
        "tag": "ooooby",
        "type": "group"
      },
      {
        "tag": "new_zealand",
        "type": "loc"
      },
      {
        "tag": "auckland",
        "type": "loc"
      },
      {
        "tag": "te_atatu_peninsula",
        "type": "loc"
      }
    ],
    "raw_text": "@ooooby offer:  a big pile of grass/compost, mostly composted, please come with a trailer and take what you want. been sitting in a heap for 6 -9 months in l:Te Atatu peninsula: for  #free until 23/07/2010",
    "message_pointer": {
      "provider_name_space": "ooooby",
      "message_id": "8c88fcd5-8eee-43d1-9a31-c1fa67654557"
    },
    "created_by": {
      "type": "OpenSocialUserPointer",
      "provider_user_name": "Tim Jacobsen",
      "provide_name_space": "ooooby",
      "profile_pic_url": "http://api.ning.com/files/pB6*uTDQQrVxzAN1eCxz3slnCaQm70o6ufqTliQU3iG5eyKdoES1LaVV24TFDSsQVXarD7nYOeqRNVNZEn4fHb3rE1IODraA/treepatternofatreemadebycuttingdownaforest.jpg?crop=1%3A1",
      "profile_url": "http://ooooby.ning.com/profile/TimJacobsen"
    },
    "offer_text": " offer:  a big pile of grass/compost, mostly composted, please come with a trailer and take what you want. been sitting in a heap for 6 -9 months in l:Te Atatu peninsula: for  #free until 23/07/2010",
    "more_info_url": null,
    "thumbnail": null,
    "end_by": "2010-07-23T00:00:00",
    "end_by_text": "23/07/2010",
    "location": {
      "geo_lat": -36.841163,
      "geo_long": 174.651783,
      "address": "Te Atatu peninsula",
      "tags": [
        {
          "tag": "new_zealand",
          "type": "loc"
        },
        {
          "tag": "auckland",
          "type": "loc"
        },
        {
          "tag": "te_atatu_peninsula",
          "type": "loc"
        }
      ]
    }
  },
 {
    "message_type": "offer",
    "timestamp": "2010-03-03T08:28:38",
    "tags": [
      {
        "tag": "offer",
        "type": "msg_type"
      },
      {
        "tag": "nuts",
        "type": "tag"
      },
      {
        "tag": "free",
        "type": "currency"
      },
      {
        "tag": "barter",
        "type": "currency"
      },
      {
        "tag": "cash",
        "type": "currency"
      },
      {
        "tag": "ooooby",
        "type": "group"
      },
      {
        "tag": "new_zealand",
        "type": "loc"
      },
      {
        "tag": "auckland",
        "type": "loc"
      },
      {
        "tag": "ostend",
        "type": "loc"
      }
    ],
    "raw_text": "@ooooby wanted:  Nuts nuts nuts!  Macadamia nuts especially but any kind of nut will do. #nuts in l:Ostend, Waiheke: for  #free #barter #cash until 01/06/2010",
    "message_pointer": {
      "provider_name_space": "ooooby",
      "message_id": "8d591b2f-95f8-4e8a-8b43-db9e25312c08"
    },
    "created_by": {
      "type": "OpenSocialUserPointer",
      "provider_user_name": "Katherine",
      "provide_name_space": "ooooby",
      "profile_pic_url": "http://api.ning.com/files/aAMmOT3TUE7dPtDKt*pOw-bCW5E1Fgi5a0-tcW-srqRDyYjMhXoeBd-6fCQsRTgO79crNvOT*DapPGWTl*HHFNx30aNGramz/PB290081.JPG?crop=1%3A1",
      "profile_url": "http://ooooby.ning.com/profile/Katherine"
    },
    "offer_text": " wanted:  Nuts nuts nuts!  Macadamia nuts especially but any kind of nut will do. #nuts in l:Ostend, Waiheke: for  #free #barter #cash until 01/06/2010",
    "more_info_url": null,
    "thumbnail": null,
    "end_by": "2010-06-01T00:00:00",
    "end_by_text": "01/06/2010",
    "location": {
      "geo_lat": -36.795923,
      "geo_long": 175.048087,
      "address": "Ostend, Waiheke",
      "tags": [
        {
          "tag": "new_zealand",
          "type": "loc"
        },
        {
          "tag": "auckland",
          "type": "loc"
        },
        {
          "tag": "ostend",
          "type": "loc"
        }
      ]
    }
  },
  {
    "message_type": "offer",
    "timestamp": "2010-03-20T22:48:10",
    "tags": [
      {
        "tag": "offer",
        "type": "msg_type"
      },
      {
        "tag": "fruit",
        "type": "tag"
      },
      {
        "tag": "barter",
        "type": "currency"
      },
      {
        "tag": "cash",
        "type": "currency"
      },
      {
        "tag": "ooooby",
        "type": "group"
      },
      {
        "tag": "new_zealand",
        "type": "loc"
      },
      {
        "tag": "auckland",
        "type": "loc"
      },
      {
        "tag": "mount_albert",
        "type": "loc"
      }
    ],
    "raw_text": "@ooooby offer:  Spray-free Feijoas! First of the season #fruit in l:Mt Albert: for  #barter #cash until 31/03/2010",
    "message_pointer": {
      "provider_name_space": "ooooby",
      "message_id": "905598e0-068d-45b6-b37b-4e0728c6d106"
    },
    "created_by": {
      "type": "OpenSocialUserPointer",
      "provider_user_name": "Kylie Thomas",
      "provide_name_space": "ooooby",
      "profile_pic_url": "http://api.ning.com/files/X-NB6cSAxK86UHvBxMmeY2IEppgFYFbNV4P-n-3ocrHocntEA9pJSuviTGkeCrD1DwHuk4L7BqKrx5k94tg0LOzvdAXeI8bQ/Photo_00014.jpg?crop=1%3A1",
      "profile_url": "http://ooooby.ning.com/profile/KylieThomas"
    },
    "offer_text": " offer:  Spray-free Feijoas! First of the season #fruit in l:Mt Albert: for  #barter #cash until 31/03/2010",
    "more_info_url": null,
    "thumbnail": null,
    "end_by": "2010-03-31T00:00:00",
    "end_by_text": "31/03/2010",
    "location": {
      "geo_lat": -36.884061,
      "geo_long": 174.71555,
      "address": "Mt Albert",
      "tags": [
        {
          "tag": "new_zealand",
          "type": "loc"
        },
        {
          "tag": "auckland",
          "type": "loc"
        },
        {
          "tag": "mount_albert",
          "type": "loc"
        }
      ]
    }
  },
  {
    "message_type": "wanted",
    "timestamp": "2010-03-03T18:05:47",
    "tags": [
      {
        "tag": "wanted",
        "type": "msg_type"
      },
      {
        "tag": "fruit",
        "type": "tag"
      },
      {
        "tag": "veges",
        "type": "tag"
      },
      {
        "tag": "free",
        "type": "currency"
      },
      {
        "tag": "cash",
        "type": "currency"
      },
      {
        "tag": "ooooby",
        "type": "group"
      },
      {
        "tag": "new_zealand",
        "type": "loc"
      },
      {
        "tag": "auckland",
        "type": "loc"
      },
      {
        "tag": "parnell",
        "type": "loc"
      }
    ],
    "raw_text": "@ooooby wanted:  Seasonal #fruit and #veges in l:Parnell, Auckland: for  #free #cash",
    "message_pointer": {
      "provider_name_space": "ooooby",
      "message_id": "9082e3e6-6395-40bc-ac1a-8b519ddd987a"
    },
    "created_by": {
      "type": "OpenSocialUserPointer",
      "provider_user_name": "Emily Harris",
      "provide_name_space": "ooooby",
      "profile_pic_url": "http://api.ning.com/files/3bWYqEHQmNYG0nkVYurjoM1scgOna4p2A2FpCY8zBX0SubPpAcJattRAHGsD-4Sen6JlJH9gnaS9wTSCDVj0ZV-k6ZQqBe*O/IMG_2585.JPG?crop=1%3A1",
      "profile_url": "http://ooooby.ning.com/profile/EmilyHarris"
    },
    "offer_text": " wanted:  Seasonal #fruit and #veges in l:Parnell, Auckland: for  #free #cash",
    "more_info_url": null,
    "thumbnail": null,
    "end_by": null,
    "end_by_text": null,
    "location": {
      "geo_lat": -36.854976,
      "geo_long": 174.780175,
      "address": "Parnell, Auckland",
      "tags": [
        {
          "tag": "new_zealand",
          "type": "loc"
        },
        {
          "tag": "auckland",
          "type": "loc"
        },
        {
          "tag": "parnell",
          "type": "loc"
        }
      ]
    }
  },
  {
    "message_type": "offer",
    "timestamp": "2010-03-03T09:08:30",
    "tags": [
      {
        "tag": "offer",
        "type": "msg_type"
      },
      {
        "tag": "barter",
        "type": "currency"
      },
      {
        "tag": "ooooby",
        "type": "group"
      },
      {
        "tag": "new_zealand",
        "type": "loc"
      },
      {
        "tag": "auckland",
        "type": "loc"
      },
      {
        "tag": "kingsland",
        "type": "loc"
      }
    ],
    "raw_text": "@ooooby offer:  Kaffir lime leaves in l:Kingsland: for  #barter until 31/03/2010 or until tree has had enough giving!",
    "message_pointer": {
      "provider_name_space": "ooooby",
      "message_id": "9466a69a-396b-4918-a34c-c4310793b41f"
    },
    "created_by": {
      "type": "OpenSocialUserPointer",
      "provider_user_name": "Denise",
      "provide_name_space": "ooooby",
      "profile_pic_url": "http://api.ning.com/files/eNL*fHQV-PTdiNbUMkT6kI5BkNz0LCTazOIRsH9IMA3b6kUsCkJjS5rlj*DNfOaEgFeBN-k95otoDrzAmTDnAi89Lq8*rS8i/selflondoncrop.jpg?crop=1%3A1",
      "profile_url": "http://ooooby.ning.com/profile/Denise"
    },
    "offer_text": " offer:  Kaffir lime leaves in l:Kingsland: for  #barter until 31/03/2010 or until tree has had enough giving!",
    "more_info_url": null,
    "thumbnail": null,
    "end_by": "2010-03-31T00:00:00",
    "end_by_text": "31/03/2010",
    "location": {
      "geo_lat": -36.869946,
      "geo_long": 174.746691,
      "address": "Kingsland",
      "tags": [
        {
          "tag": "new_zealand",
          "type": "loc"
        },
        {
          "tag": "auckland",
          "type": "loc"
        },
        {
          "tag": "kingsland",
          "type": "loc"
        }
      ]
    }
  },
  {
    "message_type": "offer",
    "timestamp": "2010-09-21T05:15:07",
    "tags": [
      {
        "tag": "offer",
        "type": "msg_type"
      },
      {
        "tag": "mint",
        "type": "tag"
      },
      {
        "tag": "free",
        "type": "currency"
      },
      {
        "tag": "ooooby",
        "type": "group"
      },
      {
        "tag": "new_zealand",
        "type": "loc"
      },
      {
        "tag": "waikato",
        "type": "loc"
      },
      {
        "tag": "te_awamutu",
        "type": "loc"
      }
    ],
    "raw_text": "@ooooby offer:  #mint plants in l:Te Awamutu: for  #free until 16/10/2010",
    "message_pointer": {
      "provider_name_space": "ooooby",
      "message_id": "9557b40a-c3cd-49a3-945e-8f26254c7ea9"
    },
    "created_by": {
      "type": "OpenSocialUserPointer",
      "provider_user_name": "Anna Holmes",
      "provide_name_space": "ooooby",
      "profile_pic_url": "http://api.ning.com/files/Abj6oQn693STtVpNku*Z-Zu7VmpHs6yn9pzPQlMWDECRUjSKSUUe*dMYnVqZiWqo7U0kSglDA7pjF8RGVs7N75oojqKUDEm5GNu0eOqC1H4_/NovDec08053.jpg?crop=1%3A1",
      "profile_url": "http://ooooby.ning.com/profile/AnnaMarieHolmes"
    },
    "offer_text": " offer:  #mint plants in l:Te Awamutu: for  #free until 16/10/2010",
    "more_info_url": null,
    "thumbnail": null,
    "end_by": "2010-10-16T00:00:00",
    "end_by_text": "16/10/2010",
    "location": {
      "geo_lat": -38.009598,
      "geo_long": 175.324179,
      "address": "Te Awamutu",
      "tags": [
        {
          "tag": "new_zealand",
          "type": "loc"
        },
        {
          "tag": "waikato",
          "type": "loc"
        },
        {
          "tag": "te_awamutu",
          "type": "loc"
        }
      ]
    }
  },
  {
    "message_type": "offer",
    "timestamp": "2010-03-03T08:34:49",
    "tags": [
      {
        "tag": "offer",
        "type": "msg_type"
      },
      {
        "tag": "cash",
        "type": "currency"
      },
      {
        "tag": "ooooby",
        "type": "group"
      },
      {
        "tag": "new_zealand",
        "type": "loc"
      },
      {
        "tag": "waikato",
        "type": "loc"
      },
      {
        "tag": "hamilton",
        "type": "loc"
      }
    ],
    "raw_text": "@ooooby offer:  Active Coastal Manuka Honey 500g ($15) and 275g ($10)\nMarokopa Spring (Rewarewa) Honey 500g  ($12)\nFarmblend Honey 500g ($9) in l:Hamilton: for  #cash",
    "message_pointer": {
      "provider_name_space": "ooooby",
      "message_id": "967a99ef-d544-4f90-8a18-680ba9b0ed5f"
    },
    "created_by": {
      "type": "OpenSocialUserPointer",
      "provider_user_name": "Stephanie Lynch",
      "provide_name_space": "ooooby",
      "profile_pic_url": "http://api.ning.com/files/C8Qf9AuHyyX*soz44DznDm9DBgCrvlD8zM3lfGQNLJldC4BFkrgos59c3nZc2-9YAOsS6RmqNqjUD*hkfkew*JHTJDbVAXN1/P1250158.JPG?crop=1%3A1",
      "profile_url": "http://ooooby.ning.com/profile/StephanieLynch"
    },
    "offer_text": " offer:  Active Coastal Manuka Honey 500g ($15) and 275g ($10)\nMarokopa Spring (Rewarewa) Honey 500g  ($12)\nFarmblend Honey 500g ($9) in l:Hamilton: for  #cash",
    "more_info_url": null,
    "thumbnail": null,
    "end_by": null,
    "end_by_text": null,
    "location": {
      "geo_lat": -37.788263,
      "geo_long": 175.283883,
      "address": "Hamilton",
      "tags": [
        {
          "tag": "new_zealand",
          "type": "loc"
        },
        {
          "tag": "waikato",
          "type": "loc"
        },
        {
          "tag": "hamilton",
          "type": "loc"
        }
      ]
    }
  },
  {
    "message_type": "offer",
    "timestamp": "2010-03-04T08:54:36",
    "tags": [
      {
        "tag": "offer",
        "type": "msg_type"
      },
      {
        "tag": "veges",
        "type": "tag"
      },
      {
        "tag": "barter",
        "type": "currency"
      },
      {
        "tag": "ooooby",
        "type": "group"
      },
      {
        "tag": "new_zealand",
        "type": "loc"
      },
      {
        "tag": "auckland",
        "type": "loc"
      },
      {
        "tag": "ostend",
        "type": "loc"
      }
    ],
    "raw_text": "@ooooby offer:  Beans #veges in l:Ostend, Waiheke: for  #barter until 10/03/2010",
    "message_pointer": {
      "provider_name_space": "ooooby",
      "message_id": "9701129d-a076-4b3e-aa88-f2bd68b00e27"
    },
    "created_by": {
      "type": "OpenSocialUserPointer",
      "provider_user_name": "Pete Russell",
      "provide_name_space": "ooooby",
      "profile_pic_url": "http://api.ning.com/files/-wn5XIwWY4*ikuGHDOktuvt0q9v0XzhuDchm-qNntRcyELYh08IxToKbpALH-qXURZvZ1XNoFnOf0yxvyjmI8p0k2BAVaIcU/Twittershot.jpg?crop=1%3A1",
      "profile_url": "http://ooooby.ning.com/profile/PeteRussell"
    },
    "offer_text": " offer:  Beans #veges in l:Ostend, Waiheke: for  #barter until 10/03/2010",
    "more_info_url": null,
    "thumbnail": null,
    "end_by": "2010-03-10T00:00:00",
    "end_by_text": "10/03/2010",
    "location": {
      "geo_lat": -36.795923,
      "geo_long": 175.048087,
      "address": "Ostend, Waiheke",
      "tags": [
        {
          "tag": "new_zealand",
          "type": "loc"
        },
        {
          "tag": "auckland",
          "type": "loc"
        },
        {
          "tag": "ostend",
          "type": "loc"
        }
      ]
    }
  },
  {
    "message_type": "offer",
    "timestamp": "2010-03-09T09:24:23",
    "tags": [
      {
        "tag": "offer",
        "type": "msg_type"
      },
      {
        "tag": "veges",
        "type": "tag"
      },
      {
        "tag": "barter",
        "type": "currency"
      },
      {
        "tag": "ooooby",
        "type": "group"
      },
      {
        "tag": "new_zealand",
        "type": "loc"
      },
      {
        "tag": "waikato",
        "type": "loc"
      },
      {
        "tag": "turangi",
        "type": "loc"
      }
    ],
    "raw_text": "@ooooby offer:  Tomatoes #veges in l:Turangi: for  #barter until 31/03/2010",
    "message_pointer": {
      "provider_name_space": "ooooby",
      "message_id": "974cd4d3-4075-434d-a1e9-fc0a6379c6c0"
    },
    "created_by": {
      "type": "OpenSocialUserPointer",
      "provider_user_name": "Clint Green",
      "provide_name_space": "ooooby",
      "profile_pic_url": "http://api.ning.com/files/*sVMKlq08SwOGRbfIrEa1dhIkDekzBwDjwjtbpzYee6-YF--xq59pWmOKpdca*02aAE3XqlTjDYpaiedHdVsnV75r42BzB5I/278252340.bin?crop=1%3A1",
      "profile_url": "http://ooooby.ning.com/profile/ClintGreen"
    },
    "offer_text": " offer:  Tomatoes #veges in l:Turangi: for  #barter until 31/03/2010",
    "more_info_url": null,
    "thumbnail": null,
    "end_by": "2010-03-31T00:00:00",
    "end_by_text": "31/03/2010",
    "location": {
      "geo_lat": -38.989372,
      "geo_long": 175.809589,
      "address": "Turangi",
      "tags": [
        {
          "tag": "new_zealand",
          "type": "loc"
        },
        {
          "tag": "waikato",
          "type": "loc"
        },
        {
          "tag": "turangi",
          "type": "loc"
        }
      ]
    }
  },
  {
    "message_type": "offer",
    "timestamp": "2010-03-04T02:26:08",
    "tags": [
      {
        "tag": "offer",
        "type": "msg_type"
      },
      {
        "tag": "seedlings",
        "type": "tag"
      },
      {
        "tag": "barter",
        "type": "currency"
      },
      {
        "tag": "cash",
        "type": "currency"
      },
      {
        "tag": "ooooby",
        "type": "group"
      },
      {
        "tag": "new_zealand",
        "type": "loc"
      },
      {
        "tag": "hawkes_bay",
        "type": "loc"
      },
      {
        "tag": "bay_view",
        "type": "loc"
      }
    ],
    "raw_text": "@ooooby offer:  Seedlings-flowers, Herbs, Fruit-list availaible on request #seedlings in l:Bay View: for  #barter #cash",
    "message_pointer": {
      "provider_name_space": "ooooby",
      "message_id": "9af7363c-26af-4897-b2dd-4705b398f9ad"
    },
    "created_by": {
      "type": "OpenSocialUserPointer",
      "provider_user_name": "Hester Robson",
